video_id,title,publishedAt,channelId,channelTitle,categoryId,trending_date,tags,view_count,likes,dislikes,comment_count,thumbnail_link,comments_disabled,ratings_disabled,description
"9jOzY38Wq3s","Patriots vs. Bills Week 8 Highlights | NFL 2018","2018-10-30T03:45:58.000Z","UCDVYQ4Zhbm3S2dlz7P1GBDg","NFL","17","18.01.11","NFL|Football|offense|defense|afc|nfc|American Football|highlight|highlights|game|games|sport|sports|play|plays|season|2018|touchdown|td|game highlights|wk 8|week 8|best plays|top plays|patriots|pats|bills|sp:ty=high|sp:dt=2018-10-30T00:15:00+00:00|sp:vl=en-US|sp:st=football|sp:li=nfl|sp:ti:home=Buf|sp:ti:away=NE|brady|anderson|mccoy|gronk|gordon|patriots highlights|bills highlights|recap|pats win","1302983","10164","604","2483","https://i.ytimg.com/vi/9jOzY38Wq3s/default.jpg","False","False","The New England Patriots take on the Buffalo Bills during Week 8 of the 2018 NFL season.Subscribe to NFL: http://j.mp/1L0bVBuCheck out our other channels:NFL Vault http://www.youtube.com/nflvaultNFL Network http://www.youtube.com/nflnetworkNFL Films http://www.youtube.com/nflfilmsNFL Rush http://www.youtube.com/nflrush#NFL #Patriots #Bills"
"sG71e_1As7s","Loz - ZeZe Freestyle #IShakuOnTheBeatAsWell | Link Up TV","2018-10-28T16:00:05.000Z","UCz7h6Eshwht37ryP7up2NmQ","Link Up TV | Music","10","18.01.11","linkuptv|link|up|tv|thelinkup.com|tim|westwood|1xtra|ukf|grime|freestyle|hip-hop|rap|city|hiphop|mixtapes|music|video|urban|london|uk|grm|jumpoff|dontflop|zane|beats|mobo|big|shaq|stormzy|hus|Behind|Barz|Behindbarz|i shaku on the beat as well|shaku|Loz|j hus","211738","4691","5637","1774","https://i.ytimg.com/vi/sG71e_1As7s/default.jpg","False","False","👉 SUBSCRIBE & ENABLE 🔔 for more: http://goo.gl/cBSDnP📱 INSTALL our UK mixtapes APP for iOS & Android: http://splt.cc/lutv➡️ Visit our website for the latest videos: http://splt.cc/thelinkupFACEBOOK: http://goo.gl/vDzP6 -- TWITTER: http://goo.gl/ZvbkKBrowse Our Online Shop: http://goo.gl/IkVjZX- - - - - - - - - - - - - - - - - - - - - - - - - - - - - - - - For enquiries visit our website or see email list below:Advertising Enquiries - advertising@linkuptv.co.ukMixtape Promotion - mixtapes@linkuptv.co.ukVideo Production - production@linkuptv.co.ukUpload your video to our YouTube Channel - http://goo.gl/rd1UTzAppear On Freestyle Show - freestyle@linkuptv.co.uk- - - - - - - - - - - - - - - - - - - - - - - - - - - - - - - -If you believe this video breaches your copyright, please direct your DMCA related emails to enea@linkuptv.co.uk"
"8BAmUw45ZkI","THE TRUTH ABOUT BOYS IN THE BEAUTY COMMUNITY","2018-10-28T20:00:47.000Z","UCkvK_5omS-42Ovgah8KRKtg","jeffreestar","26","18.01.11","jeffree star|jeffree star cosmetics|blood sugar palette|alien palette|jeffree star approved|jeffree star makeup tutorial|louis vuitton bag|cole carrigann|Anastasia Beverly Hills|cutting louis vuitton bag|jeffree star transformation|james charles|jaclyn hill|tati westbrook|boys in beauty|boys in beauty community|the truth about beauty community|patrick starrr|mmmitchell|special fx makeup|louis vuitton costume|velour liquid lipstick","2991529","156031","6658","20243","https://i.ytimg.com/vi/8BAmUw45ZkI/default.jpg","False","False","HEY EVERYONE... Welcome BACK to my channel! Today I have a special guest all the way from Dallas, Texas... Introducing Cole Carrigann! I discovered him on Twitter and was blown away by his artistry... he started uploading makeup looks THIS JANUARY!! When I found out he was going to be in LA for the Anastasia Beverly Hills Halloween party, I knew we had to do something epic!! Cutting up a Louis Vuitton bag for a makeup look? Had to!! Cole wanted to mix our worlds and I am IN LOVE with the end result! We also get candid and Cole get's really deep about the state of the beauty community and how it's hard as a new influencer to make it in this industry. Looks served, tea spilled.FOLLOW COLE CARRIGANN ON INSTAGRAM ► https://bit.ly/2z9yisaFOLLOW COLE CARRIGANN ON TWITTER ► https://twitter.com/ColeCarrigannWANT MORE?? ⭐️ WATCH MY BOYFRIEND DO MY MAKEUP! ▷ https://bit.ly/2N2wbjX❄ SHOP THE BLOOD SUGAR & ANDROGYNY PALETTES: https://jeffreestarcosmetics.com/collections/eyesLIPSTICKS WORN: Velour Liquid Lipstick shades 'Birthday Suit' & 'I'm Nude' - https://bit.ly/29dat6T*SHOP: http://www.jeffreestarcosmetics.com+ FOLLOW MY BRAND ON Instagram: http://instagram.com/jeffreestarcosmetics+FOLLOW ME ON IG: http://instagram.com/jeffreestar+ FACEBOOK: https://www.facebook.com/JeffreeStar+ SNAPCHAT: jeffreedahmer+ TWITTER: @jeffreestarWATCH MORE VIDEOS...................❤️🔮 WATCH FULL FACE OF BRANDS THAT HATE ME  ► https://bit.ly/2O6GgJi🍔 WATCH my TACOBELL MUKBANG feat. Trisha Paytas ▷ https://bit.ly/2w7amYf🎀 WATCH ME READY MEAN HATE COMMENTS IN ASMR ▷ https://bit.ly/2HUDcwr💄 WATCH SHANE DAWSON CONTROL MY LIFE FOR A DAY  ► https://bit.ly/2v077OqMUSIC: ► Focus Fire ► Mirage  - https://www.youtube.com/watch?v=j45OFioRR5Y (courtesy of NoCopyrightSounds)"
"0uIs5OVG9HI","BRUNCH at 7-ELEVEN in Seoul South Korea","2018-10-28T15:00:00.000Z","UCXOKEdfOFxsHO_-Su3K8SHg","Strictly Dumpling","19","18.01.11","korean 7 eleven|7 eleven|7 11|convenience store|korea|south korea|seoul|korean food|7-eleven|7-eleven korea|7 eleven korea food|7 11 korea|7 eleven korea|7 eleven korean noodles|korean 7 eleven food|eating korean 7 eleven|mukbang|7 eleven food|food haul|7 eleven mukbang|7 eleven cafe|korea 7-11|korea 7 eleven mukbang|food tour|ramen|ramen noodles|bento box|dumplings|kimchi|korean banana milk","1721052","32845","1307","3890","https://i.ytimg.com/vi/0uIs5OVG9HI/default.jpg","False","False","This 7-Eleven in Korea is kind of a special one because it's a Korean 7-Eleven Cafe!!! The place I went to:◈ 7-11 NamDaeMun Cafe Store73, Namdaemunsijang-gil, Jung-gu, Seoul****MORE EXCLUSIVE Content on Instagram**** http://instagr.am/Mikexingchenhttp://instagr.am/haveadumpling➨Get tickets to the best show on earth!!! http://bit.ly/2gu7REIStrictly Dumpling T-Shirts HERE: http://bit.ly/2IVM2ts►Subscribe for MORE videos about food! http://bit.ly/1hsxh41► Subscribe to our COOKING Channel! http://bit.ly/2vz2UPT------------------------------------------------------------------------------------------★↓FOLLOW ME ON SOCIAL MEDIA!↓★Facebook Show Page: https://www.facebook.com/strictlydumplingFacebook Mike Fan Page: https://www.facebook.com/mikeychenxStrictly Dumpling Instagram: http://instagr.am/haveadumplingPersonal Instagram: http://instagr.am/MikexingchenTwitter: http://twitter.com/MikexingchenTwitch: https://www.twitch.tv/mikexchen◈ Equipment I use for filming◈ :Sony RX100 Mark V: https://go.magik.ly/ml/cgc5/PANASONIC LUMIX G85: https://go.magik.ly/ml/cgcd/Wide Angle Lens: https://go.magik.ly/ml/cgck/Camera Mic: https://go.magik.ly/ml/cgcn/Camera Lights: https://go.magik.ly/ml/cgcq/Handheld Audio Recorder: https://go.magik.ly/ml/cgcr/Tripod: https://go.magik.ly/ml/cgcu/Drone: https://go.magik.ly/ml/cgcx/My Favorite Cookware!wok/pan http://amzn.to/2f5G0upAlso this pan http://amzn.to/2f5QnyiPressure pan http://amzn.to/2wJIS7uNonstick pot http://amzn.to/2wHRgq1-------------------------------------✉Send stuff to our P.O. Box!Mike Chen P.O. Box 610 Middletown, NY 10940-------------------------------------♫ Music by: Epidemic Soundhttp://www.epidemicsound.com♩ Song: Dreams by Joakim Karudhttps://soundcloud.com/joakimkarud"
"kAiMEZqtcQI","Under The Radar FC - ANOTHER MISSED PENALTY?","2018-10-28T17:59:19.000Z","UC1crUC35Gk-U_-rv5sM4PtA","Manny","20","18.01.11","FIFAManny|Manny|Manny Sunday League|Manny Under The Radar|UTR FC|Sunday League Football|Manny Football|Under The Radar FC","359151","14241","96","967","https://i.ytimg.com/vi/kAiMEZqtcQI/default.jpg","False","False","Under The Radar FC: Insta - https://www.instagram.com/undertheradarfc/Twitter: https://twitter.com/UnderTheRadarFCSTREAM: https://www.twitch.tv/ofmanny  WHERE I GOT MY PC FROM--- http://bit.ly/FIFAMannyPC  My instagram:https://www.instagram.com/manny/  Twitter: https://twitter.com/Manny_Official"
"B_cmj9QZ6dY","The ULTIMATE Lemon Meringue Tart Battle!","2018-10-28T15:59:51.000Z","UCfyehHM_eo4g5JUyWmms2LA","SORTEDfood","26","18.01.11","lemon tart|how to make a lemon tart|meringue|how to make a meringue|lemon meringue tart|cooking challenge|sorted battle|lemon tart battle|food battle|lemon curd|blowtorch meringue|pastry base|blind bake|sort food|cooking battle|chef vs normals|raspberry meringue|tart case|raspberry jelly|lemon meringue pie|how to make lemon tart|lemon tart recipe|tart au citron|homemade lemon tart|how to make a lemon tart filling","202029","8346","67","595","https://i.ytimg.com/vi/B_cmj9QZ6dY/default.jpg","False","False","The ULTIMATE Lemon Tart SHOULD have a crisp pastry base, tangy lemon filling, a thin layer of raspberry jelly, and a soft, creamy meringue topping.If they try REALLY hard, the guys might get at least one of the components right (?!)WANT TO SUPPORT SORTED?? Here's how to get involved...SUBSCRIBE to the channel and press the bell button to get notifications every time we post: https://goo.gl/pqaw14Join the Sorted club for EXCLUSIVE podcasts and video specials: https://goo.gl/otD6NFGrab a copy of our AWESOME cookbook Desserts In Duvets: https://goo.gl/dEPqooCreate and account and carry on the conversation with other foodies on our forum: https://goo.gl/P73eMrMASSIVE thank you to Jaded for our intro music, you can check them out here: http://bit.ly/JadedSpot"
"jn_fpw-uR5Y","Little Things That Ruin Your Day | Life Hacks by Blossom","2018-10-28T13:20:56.000Z","UC2WuPTt0k8yDJpfenggOAVQ","Blossom","43","18.01.11","blossom|little things|funny videos|compilation|funny|diy activities|funny videos 2018|funny fails|fail|fails|epic fails|fail compilation|best fails|funny fails 2018|fail videos|best fails 2018|funniest|fail compilation 2018|viral video|girl fail|girls fails|americas funniest videos|girls fail|funny girl|funny moments|americas funniest|funny compilation|stupid people|funny girl fails|funny fail compilation|epic fail|ruin your day|hacks","5106177","70692","4291","3142","https://i.ytimg.com/vi/jn_fpw-uR5Y/default.jpg","False","False","We can all relate to these little things that ruin your day! Check out our best life hacks! https://www.youtube.com/watch?v=Id461qSvE5A&list=PLbbdj5oHoq1I4a7IZ8fWtwgH3Qu_Y75gTSave yourself from facing embarrassing moments with these super cool life hacks! Look elegant and graceful instead of Clumsy with our awesome hacks and DIY ideas by Blossom.Blossom presents super cool diy videos which you can create at home. Simple, quick and fun DIY arts and crafts which can be done at home! So what are you waiting for? Try them now!Blossom brings you Fun craft and DIY projects to complete with your little one. Enjoy our collection of fun and easy DIY tutorials! Our easy-to-follow, wonderfully edited videos show you make these easy DIY's and hacks with ease. Thanks for watching, and subscribe today!Watch more amazing videos:https://goo.gl/Vn729GWatch Our Room Decor Videos:https://goo.gl/3bRpjMWatch Awesome Hack Videos:https://goo.gl/xBdo8p"
"CnqsxCNbSo0","QUESTIONS | The Weekly #43 | LIFESTYLE","2018-10-28T10:00:00.000Z","UCfAEEhKikW1676DCa_0OWLA","Sprinkleofglitter","26","18.01.11","Louise Pentland|Sprinkle Of Glitter|Sprinkleofglitter|Mummy Vlogger|Mummy Blogger|Mom Vlogger|Mom Blogger|Motherhood|UK Parenting Channel|MumLife","122327","5520","165","393","https://i.ytimg.com/vi/CnqsxCNbSo0/default.jpg","False","False","A little Q&A all about The Weekly! See you next week for a much more normal vlog!!!"
"Q3w7Fz6KFa8","Gordon Ramsay Cooks Sea Bass On A Car Engine!","2018-10-28T18:00:02.000Z","UCIEv3lZ_tNXHzL3ox-_uUGQ","Gordon Ramsay","24","18.01.11","Gordon|Gordon Ramsay|Ramsay|Ramsey|Chef Ramsay|Recipe|Recipes|Food|Cooking|Cookery|matilda ramsay|matilda ramsay cooking show|matilda ramsay and the ramsay bunch|matilda ramsay 2018|matilda ramsay and gordon|gordon ramsay cooking tips|gordon ramsay seafood|gordon ramsay sea bass|sea bass|sea bass recipe gordon ramsay","763128","13563","1194","3207","https://i.ytimg.com/vi/Q3w7Fz6KFa8/default.jpg","False","False","Next time don't forget the charcoal. Gordon Ramsay’s Ultimate Cookery Course – http://amzn.to/2BzAud5Subscribe for weekly cooking videos. If you liked this clip check out the rest of Gordon's channels:http://www.youtube.com/gordonramsayhttp://www.youtube.com/kitchennightmareshttp://www.youtube.com/thefword"
"4OOSTGB3WYY","Pearce and Price lead Red Sox to World Series victory: 10/28/18","2018-10-29T07:19:01.000Z","UCoLrcjPV5PbUrUyXq5mjc_A","MLB","17","18.01.11","sp:li=MLB|sp:ti:home=LAD|sp:dt=2018-10-29T00:15:00Z|sp:st=baseball|sp:ti:away=BOS|sp:vl=en-US|sp:ty=high","553954","4658","792","1299","https://i.ytimg.com/vi/4OOSTGB3WYY/default.jpg","False","False","Daily Recap: The Red Sox offense was powered by Steve Pearce's two homers and a pair of solo shots from Mookie Betts and J.D. Martinez, while David Price shined on the mound once again to lead Boston to their 9th World Series in franchise historyAbout Major League Baseball: Major League Baseball (MLB) is the most historic professional sports league in the United States and consists of 30 member clubs in the U.S. and Canada, representing the highest level of professional baseball. Led by Commissioner Robert D. Manfred, Jr., MLB currently features record levels of labor peace, competitive balance and industry revenues, as well as the most comprehensive drug-testing program in American professional sports. MLB remains committed to making an impact in the communities of the U.S., Canada and throughout the world, perpetuating the sport’s larger role in society and permeating every facet of baseball’s business, marketing and community relations endeavors. With the continued success of MLB Advanced Media and MLB Network, MLB continues to find innovative ways for its fans to enjoy America’s National Pastime and a truly global game.The American League consists of the following teams: Baltimore Orioles; Boston Red Sox; Chicago White Sox; Cleveland Indians; Detroit Tigers; Houston Astros; Kansas City Royals; Los Angeles Angels ; Minnesota Twins; New York Yankees; Oakland Athletics; Seattle Mariners; Tampa Bay Rays; Texas Rangers; and Toronto Blue Jays. The National League, originally founded in 1876, consists of the following teams: Arizona Diamondbacks; Atlanta Braves; Chicago Cubs; Cincinnati Reds; Colorado Rockies; Los Angeles Dodgers; Miami Marlins; Milwaukee Brewers; New York Mets; Philadelphia Phillies; Pittsburgh Pirates; San Diego Padres; San Francisco Giants; St. Louis Cardinals; and Washington Nationals.Visit MLB.com: http://mlb.mlb.comSubscribe to MLB.TV: http://mlb.tvDownload MLB At Bat: http://mlb.mlb.com/mobile/atbatDownload MLB Ballpark: http://mlb.mlb.com/mobile/attheballparkDownload MLB Clubhouse: http://mlb.com/clubhousePlay Beat The Streak: http://mlb.mlb.com/btsPlay R.B.I. Baseball: http://www.rbigame.comPlay Home Run Derby: http://mlb.mlb.com/mlb/fantasy/hr_derby/index.jspGet MLB Tickets: http://mlb.mlb.com/ticketsGet Official MLB Merchandise: http://www.mlbshop.com/Check out http://MLB.com/video for more!Connect with us:Facebook: http://facebook.com/mlbInstagram: http://instagram.com/mlbTwitter: http://twitter.com/mlb"
"fSOpiZo1BAA","Little Mix - Woman Like Me (Official Video) ft. Nicki Minaj","2018-10-25T23:01:00.000Z","UCssD3_aDYhaG44mwP53CO0w","littlemixVEVO","10","18.01.11","Little Mix feat. Nicki Minaj|Pop|Syco Music|Woman Like Me","21492889","1253527","30460","76268","https://i.ytimg.com/vi/fSOpiZo1BAA/default.jpg","False","False","Little Mix – Woman Like Me ft. Nicki Minaj (Official Music Video) – Listen here: http://smarturl.it/WomanLikeMe Get it on iTunes http://smarturl.it/WomanLikeMe/itunesApple: http://smarturl.it/WomanLikeMe/applem...GooglePlay: http://smarturl.it/WomanLikeMe/google...Spotify: http://smarturl.it/WomanLikeMe/spotifyAmazon: http://smarturl.it/WomanLikeMe/amazon... Stream more music from Little Mix here: http://smarturl.it/LMixSpotify More from Little Mix Cheat Codes, Little Mix - Only You: https://youtu.be/T2sO8gK2IKk Nothing Else Matters: https://youtu.be/RlSzahonkTk  CNCO, Little Mix - Reggaetón Lento: https://youtu.be/UONnRMuuDpsFollow Little Mix:Facebook https://www.facebook.com/LittleMixOff... Twitter https://twitter.com/LittleMix  Instagram https://www.instagram.com/littlemix/  More great videos here http://smarturl.it/littlemixVEVO  Subscribe to Little Mix on YouTube: http://smarturl.it/littlemixYTLyricsJESYI always say what I’m feelingI was born without a zip on my mouthSometimes I don't even mean itIt takes a little while to figure me outLEIGHI like my coffee with two sugars in itHigh heels and my jewellery drippingDrink and I get all fired up, hey, hey, heyInsecure but I’m working with itMany things that I could get rid ofAin’t about to give it upJADEI made a few mistakes I regret it nightlyI broke a couple hearts that I wear on my sleeveMy momma always said, “girl you’re trouble” andAnd now I wonder could you fall for a woman like mePERRIEAnd every time we touch boy you make me feel weakI can tell you’re shy and I think you’re so sweetSpending every night under covers andStill I wonder could you fall for a woman like meCHORUSWoman like me, like a woman like me, la la laWoman like me, like a woman like me, la la laWoman like me, like a woman like me, la la laWoman like me, like a woman like meJESYAnd baby just be mine for the weekendWe can get a takeaway and sit on the couchOr we could just go out for the eveningHopefully end up with you kissing my mouthLEIGHYou got them blue jeans with a rip up in themMy hair with your fingers in itLove it when you turn me onYoncé with a little bit ofLove drunk in the middle with itGet down to our favourite songJADEI made a few mistakes I regret it nightlyI broke a couple hearts that I wear on my sleeveMy momma always said, “girl you’re trouble” andAnd now I wonder could you fall for a woman like mePERRIEAnd every time we touch boy you make me feel weakI can tell you’re shy and I think you’re so sweetSpending every night under covers andStill I wonder could you fall for a woman like meCHORUSNICKI (RAP)    Woman like meYes a woman like meSoon as I brush up on himI could tell he like meYou know all the mandem a try to swipe meKnotted up he could afford to ice meTell’em it’s a bad trini bitch in ah ya areaBut the more bad bitches then the more merrierBaddies to my left and to the right a little scarierRude boy tell me can you handle all this derriere?A million I’m getting my billy onGreatest of all time cus I’m a chameleonI switch it up for every era, I’m really bombThese bitches really wanna be NickiI’m really momApple cut the check I want all this moneySeven up go grip the techAnd leave all this bloodyIt’s the queen and Little MixSkated on them. SorryMy daddy is Indian- swish all this CurryWoman like me, like a woman like me, la la laWoman like me, like a woman like meJADEI made a few mistakes I regret it nightly,I broke a couple hearts that I wear on my sleeve,My Mumma always said, “girl you’re trouble” andAnd now I wonder could you fall for a woman like me,PERRIEAnd every time we touch boy you make me feel weak,I can tell you’re shy and I think you’re so sweet,Spending every night under covers"
"SAWzXkV3hHo","Shawn Mendes, Zedd - Lost In Japan (Original + Remix)","2018-10-26T02:40:35.000Z","UC4-TgOSMJHn-LtY4zCzbQhw","ShawnMendesVEVO","10","18.01.11","Shawn|Mendes|Zedd|Lost|In|Japan|(Original|Remix)|Island|Records|Pop|shawn mendes lost in japan|lost in japan shawn mendes|shawn mendes zedd lost in japan remix|lost in japan remix shawn mendes zedd|zedd lost in japan remix|lost in japan remix zedd|lost in japan official music video|lost in japan remix official music video|lost in japan music video|let’s get lost tonight|i can’t get you off my mind","12152765","963058","12109","60391","https://i.ytimg.com/vi/SAWzXkV3hHo/default.jpg","False","False","Lost In Japan: https://IslandRecs.lnk.to/LostInJapan Lost In Japan (Remix): https://islandrecs.lnk.to/LostInJapanRemixStream/buy Shawn Mendes: The Album now: https://IslandRecs.lnk.to/ShawnMendesFollow Shawn Mendes:Twitter: https://twitter.com/shawnmendesInstagram: https://www.instagram.com/shawnmendesFacebook: https://www.facebook.com/ShawnMendesOfficialWebsite: https://www.shawnmendesofficial.comFollow Zedd:Subscribe to YouTube channel: http://zedd.me/YTSubscribeWebsite: https://www.zedd.netFacebook: http://zedd.me/FacebookInstagram: http://zedd.me/InstagramSpotify: http://zedd.me/SPEssentialsTwitter: http://zedd.me/TwitterVK: http://zedd.me/VKcomSnapchat: http://zedd.me/SnapchatShop the Zedd Official Store: http://zedd.me/StoreListen to Zedd Radio: http://zedd.me/SPRadioSee Zedd live: http://zedd.me/LiveLyrics:All it'd take is one flightWe be in the same time zoneLooking through your timelineSeeing all the rainbows, II got an ideaAnd I know that it sounds crazyI just wanna see yaAll I gotta ask,Do you got plans tonight?I’m a couple hundred miles from Japan and IAnd I was thinking I could fly to your hotel tonight‘Cause I can’t get you off my mindCan’t get you off my mindCan’t get you off my mind (uhh)I can feel the tensionWe could cut it with a knifeI know it’s more than just a friendshipI can hear you think I’m right, yeahDo I gotta convince you that you shouldn’t fall asleep?It’ll only be a couple hours,And I’m about to leaveDo you got plans tonight?I’m a couple hundred miles from Japan and IAnd I was thinking I could fly to your hotel tonight‘Cause I can’t get you off my mindCan’t get you off my mindCan’t get you off my mindDo you got plans tonight?I was hoping I could get lost in your paradiseThe only thing I’m thinking ‘bout is you and i‘Cause I can’t get you off my mindCan’t get you off my mindI can’t seem to get you off my mindLet’s get lost tonight (uhh)Let’s get lost tonightBaby you and…I can’t seem to get you off my mindLet’s get lost tonightLet’s get lost tonightBaby you and…I can’t seem to get you off my mindDo you got plans tonight?I’m a couple hundred miles from Japan and IAnd I was thinking I could fly to your hotel tonight‘Cause I can’t get you off my mindI can’t get you off my mindDo you got plans tonight, babyI was hoping I could get lost in your paradiseThe only thing I’m thinking ‘bout is you and IAnd I can’t get you off my mindCan’t get you off my mindI can’t seem to get you off my mindLet’s get lost tonightLet’s get lost tonightBaby you and…I can’t seem to get you off my mindLet’s get lost tonightLet’s get lost tonightBaby you and…I can’t seem to get you off my mindMusic video by Shawn Mendes, Zedd performing Lost In Japan (Original + Remix). © 2018 Island Records, a division of UMG Recordings, Inc.http://vevo.ly/txtHgL"
"52nfjRzIaj8","Lady Gaga, Bradley Cooper - I'll Never Love Again (A Star Is Born)","2018-10-26T03:44:56.000Z","UC07Kxew-cMIaykMOkzqHtBQ","LadyGagaVEVO","10","18.01.11","Lady|Gaga|Bradley|Cooper|I'll|Never|Love|Again|Star|is|Born|OST|Soundtrack","12715935","404349","5106","17833","https://i.ytimg.com/vi/52nfjRzIaj8/default.jpg","False","False","Listen to brand new music from Bradley Cooper & Lady Gaga from the 'A Star Is Born' Soundtrack: http://smarturl.it/ASIBSoundtrackGet tickets to see the film:US: http://www.astarisbornmovie.com/#/GetTicketsInternational: http://www.astarisborninternational.comFollow Lady Gaga:Facebook: http://gaga.lk/facebookTwitter: http://gaga.lk/TwitterInstagram: http://gaga.lk/InstagramSnapchat: http://gaga.lk/SnapchatSpotify: http://gaga.lk/SpotifyEmail List: http://gaga.lk/NewsMusic video by Lady Gaga, Bradley Cooper performing I'll Never Love Again. © 2018 Interscope Recordshttp://vevo.ly/ijhjYK"
"6Xlo2abddXU","George Ezra - Hold My Girl (Official Video)","2018-10-26T07:00:01.000Z","UC9xncyB15xEnnWfgBp8wAeg","GeorgeEzraVEVO","10","18.01.11","george ezra|george ezra shotgun|george ezra paradise|george ezra budapest|george ezra listen to the man|george ezra shotgun lyrics|george ezra blame it on me|george ezra interview|george ezra album|george ezra live|george ezra shotgun remix|george ezra hold my girl|george ezra hold my girl lyics|george ezra new single|george ezra new song|george ezra new album|george ezra 2018|george ezra tour|george ezra staying at tamara's","786135","37739","506","1956","https://i.ytimg.com/vi/6Xlo2abddXU/default.jpg","False","False","George Ezra - Hold My Girl (Official Video)'Hold My Girl' is from the new album Staying At Tamara's - get it now: http://smarturl.it/StayingAtTamaras?IQid=yt Listen to 'Hold My Girl' on streaming services: http://smarturl.it/HoldMyGirl?IQid=yt----------Sign up to George's newsletter: http://smarturl.it/EzraNL?IQid=yt Sign up to George's weekly journal: http://smarturl.it/GeorgeEzraJournal?IQid=yt----------Follow George EzraFacebook: http://smarturl.it/GeorgeEzraFB?IQid=yt Twitter: http://smarturl.it/GeorgeEzraTwitter?IQid=yt Instagram: http://smarturl.it/GeorgeEzraIG?IQid=yt ----------Lyrics:I’ve been waiting for you To come around and tell me the truth'Bout everything that you’re going throughMy girl you’ve got nothing to loseCold nights and the Sunday mornings On your way and out of the grey Chorus:I’ve got time I’ve got loveGot confidence you’ll rise above Give me a minute to hold my girl Give me a minute to hold my girlCrowded town or silent bedPick a place to rest your headGive me a minute to hold my girlGive me a minute to hold my girlI’ve been dreaming about usWorking hard and saving it up We’ll go and see the man on the MoonMy girl we’ve got nothing to loseCold nights and the Sunday mornings On your way and out of the grey ChorusMy girl, my girl It takes one hot second to turn it aroundIt takes one hot second to turn it aroundChorus x2"
