video_id,title,publishedAt,channelId,channelTitle,categoryId,trending_date,tags,view_count,likes,dislikes,comment_count,thumbnail_link,comments_disabled,ratings_disabled,description
"7kgOUz9KJAI","Villain Pub - Trick or Treat","2018-10-30T17:00:50.000Z","UCHCph-_jLba_9atyCZJPLQQ","How It Should Have Ended","1","18.01.11","Halloween|Trick or Treat|halloween candy|Villain Pub|HISHE|Animated|Cartoon|comedy|funny|parody|costumes|joker|voldemort|Loki|pikachu|batman|harry potter|spider-man|teen titans|family friendly","839973","53040","409","3746","https://i.ytimg.com/vi/7kgOUz9KJAI/default.jpg","False","False","Get your first audiobook free when you try Audible for 30 day visit https://www.audible.com/hishe or text hishe to 500 500! It's Halloween and some of the Villain Pub Patrons are not happy about it.Watch More HISHEs: https://bit.ly/HISHEPlaylistSubscribe to HISHE: https://bit.ly/HISHEsubscribeFOLLOW HISHE!Twitter @theHISHEdotcomhttp://bit.ly/HISHETwitterInstagram @HISHEgramhttps://instagram.com/hishegram/Facebook: http://bit.ly/HISHE-FBHISHE Swag:http://www.dftba.com/HISHE--------------Previous Episodes--------------------How Ant-Man and The Wasp Should Have Endedhttps://youtu.be/kFQ2NvlCc6MHISHE Horror Compilationhttps://youtu.be/K6FteqXWtYIHow Solo: A Star Wars Story Should Have Endedhttps://youtu.be/u3kBzyJJDakHow Jurassic World Fallen Kingdom Should Have Endedhttps://youtu.be/OiaXHny9KD0Predator HISHE Dubshttps://youtu.be/q68Oog85VQwHow The Venom Trailer Should Have Endedhttps://youtu.be/datvIBL-5tISuper Cafe - Teens and Titanshttps://youtu.be/zg46XxztfUsHow Deadpool 2 Should Have Endedhttps://youtu.be/XU3NWji4h7sHow Avengers Infinity War Should Have Endedhttps://youtu.be/NcEbZ_vexA8Infinity War Alternate HISHEhttps://youtu.be/eKMTHW6qfSwThe Last Jedi Lego Summaryhttps://youtu.be/nbPvj-2Z9JgJurassic World Alternate HISHEhttps://youtu.be/nk2GT1Msa2UJurassic World - Comedy Recap (HISHE Dubs)https://youtu.be/CUouUdYWh6gOceans Over 40 Trailerhttps://youtu.be/3QeNuWWQe5IHow Black Panther Should Have Endedhttps://youtu.be/oV0zkMe1K8sVillain Pub - The Dead Poolhttps://youtu.be/3DGlk_JAm8UHow Justice League Should Have Endedhttps://youtu.be/zj_y8eAKpQUHow Star Wars The Last Jedi Should Have Endedhttps://youtu.be/rCB8DUGpYQQHow Thor Ragnarok Should Have Endedhttps://youtu.be/lPZRmkVLeOEHow Spider-Man Homecoming Should Have Endedhttps://youtu.be/hjuHNdEgN30Avengers Infinity War and Beyond (Toy Story Mashup)https://youtu.be/bvXxLp_G9w0How IT Should Have Endedhttps://youtu.be/gh0WvZtbATEBatman V Superman - Comedy Recaphttps://youtu.be/bNjhtHyihJ0How The Incredibles Should Have Endedhttps://youtu.be/C0VJaFN4bncVillain Pub - Penny For Your Fearshttps://youtu.be/ZLyulYMZbj8Blade Runner - Comedy Recaphttps://youtu.be/fVwe9xXBdHQRogue One LEGO HISHE - Chirrut VS Everythinghttps://youtu.be/T5jK4XnaAQQHow Wonder Woman Should Have Endedhttps://youtu.be/Lf6gl4-MPd0How Guardians of the Galaxy Vol.2 Should Have Endedhttps://youtu.be/GBxxjhnjH4YHow Jurassic World Should Have Ended:https://youtu.be/TXGCyjJh48IHulk Spoils Movieshttps://youtu.be/HAg3fuFczs0How Kong Skull Island Should Have Endedhttps://youtu.be/C3H0OWehlVI?list=PL3...How Rogue One Should Have Endedhttps://youtu.be/RjR71XpAu0I?list=PL3...How Moana Should Have Endedhttps://youtu.be/4aHGssCxMo4?list=PL3...How The LEGO Batman Movie Should Have Endedhttps://youtu.be/g7OH2OhIjJAHow Doctor Strange Should Have Endedhttps://youtu.be/9e5epVDd9h0?list=PL3...How Beauty and the Beast Should Have Endedhttps://youtu.be/8hm9ezomDhQHow Star Wars Should Have Ended (Special Edition)https://youtu.be/oXUJiHut7YE?list=PLi...More HISHE Reviewshttps://www.youtube.com/playlist?list...Villain Pub - The Boss Battlehttps://youtu.be/bt__1gwGZSA?list=PL3...LEGO Harry Potter in 90 Secondshttps://youtu.be/jnbBcAr7XGo?list=PL3...Suicide Squad HISHEhttps://youtu.be/Wje0SdFWrzUHow Guardians of the Galaxy Vol.1 Should Have Endedhttps://youtu.be/d0K436vUM4wStar Trek Beyond HISHEhttps://youtu.be/Fymz7yoELS4?list=PL3...Super Cafe: Batman GOhttps://youtu.be/KntOy6am7CM?list=PL3...Civil War HISHEhttps://youtu.be/fvLw021rVN0Villain Pub - The New Smilehttps://youtu.be/0oP8s4GK1BE?list=PLA...How Batman V Superman Should Have Endedhttps://youtu.be/pTuyfQ5CR4QTMNT: Out of the Shadows HISHEhttps://youtu.be/_ac8xKxeqzk?list=PL3...How Deadpool Should Have Endedhttps://youtu.be/5vbEcTIAdPs?list=PL3...Hero Swap - Gladiator Starring Iron Manhttps://youtu.be/P4mY4qmuJas?list=PL3...How X-Men: Days of Future Past Should Have Ended:https://youtu.be/uT6YOI6JcRsStar Wars - Revenge of the Sith HISHEhttps://youtu.be/K2ScVx4mRDEBAT BLOOD - A Batman V Superman AND Bad Blood Parody ft. Batman:https://youtu.be/maX-ObiJB3o"
"SdKtSpJaSrE","Our Alligator Gets a New Toy!","2018-10-30T14:58:12.000Z","UCnIrLy19cFV50Eai8Xj-ArA","Snake Discovery","27","18.01.11","alligators|crocodiles|alligator toy|enrichment for reptiles|reptiles|pet alligator|having a pet gator|reptile toys|reptiles playing|alligator playing|animal enrichment|worthington waterway barriers","188530","9596","85","1666","https://i.ytimg.com/vi/SdKtSpJaSrE/default.jpg","False","False","Checkout Worthington Waterway Barriers's industrial-strength products here!: www.tuffboom.com Crocodilians are smart. Sometimes too smart for their own good. Because of this, enrichment opportunities are essential for their mental well-being. In this video we introduce Rexy (our alligator) to a brand new toy and her reaction is priceless!Music by Bensound and YouTube creator studio library used under the creative commons license."
"EqfoLiK_xTg","Kelly Clarkson's Wowed by Abby Cates' Confident Cover of Because of You - The Voice 2018 Knockouts","2018-10-31T00:46:56.000Z","UCpdK1NLHxEUGXc1gq2NxkTw","The Voice","24","18.01.11","the voice|the voice nbc|the voice season 15|the voice knockouts|the voice knockout|team adam|adam levine|team jennifer|jennifer hudson|team kelly|kelly clarkson|team blake|blake shelton|knockouts|because of you|abby cates|performer|the voice new season|The Voice 2018|The Voice USA|The Voice Season 15|The voice winners|Jennifer Hudson|Kelly Clarkson|carson daly","550553","16346","196","875","https://i.ytimg.com/vi/EqfoLiK_xTg/default.jpg","False","False","Team Kelly's Abby Cates honors her coach by performing Because of You in The Voice Knockouts.» Get The Voice Official App: http://bit.ly/TheVoiceOfficialApp» Subscribe for More: http://bit.ly/TheVoiceSub» Watch The Voice Mondays & Tuesdays 8/7c on NBC!» Stream Anytime: http://bit.ly/TheVoiceFullEpisodesTHE VOICE ON SOCIAL:Like The Voice: http://Facebook.com/NBCTheVoiceFollow The Voice: https://Twitter.com/NBCTheVoiceThe Voice Tumblr: http://nbcTheVoice.Tumblr.com/Follow The Voice on Instagram: https://instagram.com/nbcthevoice/#TheVoice #VoiceKnockouts #KellyClarkson #TheVoice2018 #TheVoiceUSA #NBC #AbbyCates #BecauseofYou #Cover #TeamKelly #Music #AdamLevine #BlakeShelton #JenniferHudsonNBC’s The Voice follows the strongest vocalists from across the country and invites them to compete in this season's blockbuster vocal competition.Find The Voice trailers, full episode highlights, previews, promos, clips, and digital exclusives here.NBC ON SOCIAL:NBC YouTube: http://www.youtube.com/nbcLike NBC: http://Facebook.com/NBCFollow NBC: http://Twitter.com/NBCNBC Tumblr: http://nbctv.tumblr.com/NBC Google+: https://plus.google.com/+NBC/postsNBC Instagram: http://instagram.com/nbcABOUT THE VOICEThe Voice 2018 USA YouTube channel features exclusive content with The Voice coaches, highlights from The Voice auditions, interviews with The Voice winners, as well as The Voice recaps and results. Learn more about The Voice contestants, The Voice tour, the eliminations, and follow your favorite performers all the way to the finale. In season 15, returning coaches Adam Levine, Blake Shelton, Kelly Clarkson and welcomes back Jennifer Hudson as celebrity musician coaches, while Carson Daly continues to serve as host. The show’s innovative format features five stages of competition: the first begins with the blind auditions, followed by the battle rounds, the knockouts, the live playoffs and finally, the live performance shows.Kelly Clarkson's Wowed by Abby Cates' Confident Cover of Because of You - The Voice 2018 Knockoutshttps://youtu.be/EqfoLiK_xTgThe Voicehttp://www.youtube.com/user/nbcthevoice"
"tM3txaBxhto","Rey Mysterio & Jeff Hardy vs. Randy Orton & The Miz: SmackDown LIVE, Oct. 30, 2018","2018-10-31T02:51:01.000Z","UCJ5v_MCY6GNUBTO8-D3XoAg","WWE","17","18.01.11","wwe|world wrestling entertainment|wrestling|wrestler|wrestle|superstars|कुश्ती|पहलवान|डब्लू डब्लू ई|मैच|सुपरस्टार|व्यावसायिक कुश्ती|مصارعه|SmackDown|Rey Mysterio|Jeff Hardy|Randy Orton|The Miz|sp:ty=high|sp:st=wrestling|sp:scp=athlete_in_match|sp:dt=2018-10-30T20:00:00-04:00|sp:ev=wwe-smack|sp:ath=wwe-rndyo|sp:ath=wwe-jefha|sp:ath=wwe-thmiz|wwe smackdown live|randy orton vs jeff hardy|wwe smackdown highlights|smackdown highlights","752593","17181","372","1098","https://i.ytimg.com/vi/tM3txaBxhto/default.jpg","False","False","Team Blue's entrants in the WWE World Cup square off in a massive tag team main event just days before the tournament to determine the best in the world.#SDLive #WWEWorldCupGET YOUR 1st MONTH of WWE NETWORK for FREE: http://wwenetwork.com---------------------------------------------------------------------Follow WWE on YouTube for more exciting action!---------------------------------------------------------------------Subscribe to WWE on YouTube: http://bit.ly/1i64OdTCheck out WWE.com for news and updates: http://goo.gl/akf0J4Find the latest Superstar gear at WWEShop: http://shop.wwe.com---------------------------------------------Check out our other channels!---------------------------------------------The Bella Twins: https://www.youtube.com/thebellatwinsUpUpDownDown: https://www.youtube.com/upupdowndownWWEMusic: https://www.youtube.com/wwemusicTotal Divas: https://www.youtube.com/wwetotaldivas------------------------------------WWE on Social Media------------------------------------Twitter: https://twitter.com/wweFacebook: https://www.facebook.com/wweInstagram: https://www.instagram.com/wwe/Reddit: https://www.reddit.com/user/RealWWEGiphy: https://giphy.com/wwe"
"LHtgIWSUPew","Ariana Grande - God is a Woman (Ariana Grande At The BBC)","2018-10-29T17:37:09.000Z","UCZtDUmC3W7j25XHZWFT_XgQ","BBC Music","10","18.01.11","bbc|music|Ariana Grande|orchestra|Ariana Grande At The BBC|BBC One|Davina McCall. God is a Woman","1004266","79984","1435","5799","https://i.ytimg.com/vi/LHtgIWSUPew/default.jpg","False","False","In an exclusive performance Ariana Grande is accompanied by an all-female orchestra for Ariana Grande At The BBC - a special programme for BBC One, hosted by Davina McCall - Watch on BBC One from 2000 on Thursday November 1st 2018.  More from Ariana Grande at the BBC:https://www.bbc.co.uk/programmes/b0bqmws3"
"Q197NAsuhPI","iPad Pro 2018 hands-on: Apple’s new all-screen tablet","2018-10-30T19:03:17.000Z","UCddiUEpeqJcYeBxX1IVBKvQ","The Verge","28","18.01.11","ipad|2018 ipad pro|ipad 2018|new ipad pro|ipad pro|apple ipad|new ipad 2018|new ipad|2018 ipad|hands on|apple|keynote|ipad air|apple event|apple keynote|2018 ipad review|2018|what to expect|tim cook|apple products|steve jobs|apple 2018|event|new iphones|rumors|apple ny|apple media event|apple official|technology|top 10|gadgets|tech|first look|latest updates|google|android|iphone|review|microsoft|verge|the verge","735255","12425","510","2380","https://i.ytimg.com/vi/Q197NAsuhPI/default.jpg","False","False","Apple announced a new, completely redesigned iPad Pro and we just got to spend a few minutes trying it out. The iPad Pro no longer has a home button; that’s been replaced with Face ID. The transition to Face ID allowed Apple to make the iPad’s side bezels slimmer than ever before, and the result might be the truest embodiment of a “tablet” yet. This thing is just a giant, beautiful screen.Subscribe: http://goo.gl/G5RXGsLike The Verge on Facebook: https://goo.gl/2P1aGcFollow on Twitter: https://goo.gl/XTWX61Follow on Instagram: https://goo.gl/7ZeLvXRead More: http://www.theverge.comCommunity guidelines: http://bit.ly/2D0hlAvSubscribe to Verge Science on YouTube, a new home base for our explorations into the future of science: http://bit.ly/2FqJZMl"
"rMNAdHqGMhs","Rami Malek Discusses His Freddie Mercury Transformation","2018-10-30T04:01:21.000Z","UC8-Th83bH_thdKZDJCrn88g","The Tonight Show Starring Jimmy Fallon","23","18.01.11","The Tonight Show|Jimmy Fallon|Rami Malek|Discusses|Freddie Mercury|Transformation|TSJF Interview|NBC|NBC TV|Television|Funny|Talk Show|comedic|humor|snl|tonight|show|jokes|funny video|interview|variety|comedy sketches|talent|celebrities|video|clip|highlight|Mr. Robot|Bohemian Rhapsody|Rami Malek on Fallon|Rami Malek Interview|Rami Malek Freddie Mercury|Short Term 12|The Master|Need for Speed","943952","18945","360","1886","https://i.ytimg.com/vi/rMNAdHqGMhs/default.jpg","False","False","Rami Malek chats with Jimmy about Mr. Robot coming to an end and the key to his successful Freddie Mercury impression in the Bohemian Rhapsody biopic.Subscribe NOW to The Tonight Show Starring Jimmy Fallon: http://bit.ly/1nwT1aNWatch The Tonight Show Starring Jimmy Fallon Weeknights 11:35/10:35cGet more Jimmy Fallon: Follow Jimmy: http://Twitter.com/JimmyFallonLike Jimmy: https://Facebook.com/JimmyFallonGet more The Tonight Show Starring Jimmy Fallon: Follow The Tonight Show: http://Twitter.com/FallonTonightLike The Tonight Show: https://Facebook.com/FallonTonightThe Tonight Show Tumblr: http://fallontonight.tumblr.com/Get more NBC: NBC YouTube: http://bit.ly/1dM1qBHLike NBC: http://Facebook.com/NBCFollow NBC: http://Twitter.com/NBCNBC Tumblr: http://nbctv.tumblr.com/NBC Google+: https://plus.google.com/+NBC/postsThe Tonight Show Starring Jimmy Fallon features hilarious highlights from the show including: comedy sketches, music parodies, celebrity interviews, ridiculous games, and, of course, Jimmy's Thank You Notes and hashtags! You'll also find behind the scenes videos and other great web exclusives.Rami Malek Discusses His Freddie Mercury Transformationhttp://www.youtube.com/fallontonight#FallonTonight#RamiMalek#JimmyFallon"
"CfY8l2HT9ZA","Girl Talk As You Grow Up","2018-10-29T22:49:43.000Z","UCfm4y4rHF5HGrSr-qbvOwOg","IISuperwomanII","23","18.01.11","iisuperwomanii|superwoman|team super|comedy|skit|rant|lilly singh|youtube superwoman|manjeet|paramjeet|parents|types of people|superwoman youtube|Girl Talk As You Grow Up|Lilly Singh Girl Talk|lilly singh girl talk|iisuperwomanii girltalk|superwoman girl talk|iisuperwomanii grow up|lilly grow up|as you grow|lilly growing|iisuperwomanii growing|grow up talk|girl grow up|talk girl","1392220","113937","1779","6995","https://i.ytimg.com/vi/CfY8l2HT9ZA/default.jpg","False","False","￼Remember when you were in kindergarten and girl talk consisted of playing house and juice box flavours? And now y’all playing house for real and drink all the wines.Subscribe: http://bit.ly/SubLillySingh | MERCH: https://lillysingh.comWatch If Girl Talk Sounded Like Guy Talk - https://youtube.com/watch?v=mhBZk3u4BbI If you want to add translations, click the gear icon and go to Subtitles/CC then to Add subtitles or CC! Follow Paramjeet:Instagram: https://instagram.com/iiparamjeetii/Twitter: https://twitter.com/iiparamjeetii/ Follow Manjeet:Instagram: https://instagram.com/iimanjeetii/Twitter: https://twitter.com/iimanjeetii/ Get HOW TO BE A BAWSE: https://lillysinghbook.com Follow Lilly Singh:Facebook: https://facebook.com/IISuperwomanII/Instagram: https://instagram.com/iisuperwomanii/Twitter: https://twitter.com/iisuperwomaniiLilly Singh Vlogs: https://youtube.com/user/SuperwomanVlogsOfficial Website: http://lillysingh.com/ Watch More Lilly Singh:Types Of People: https://youtube.com/watch?v=eR_nzGqYXNw&list=PLuBXqtS2jaLMu81JnF6AOnRHzG6Csbd6yMy Parents: https://youtube.com/watch?v=EPHMXbZml_s&list=PLuBXqtS2jaLOGQynSYvxaqUgvNl7Ovz8xSkits: https://youtube.com/watch?v=jyxi0rfEDnE&list=PLuBXqtS2jaLMhu9PU0tAaHbnqloWibwl0The Super Rants: https://youtube.com/watch?v=KYadw8gNOok&list=PLuBXqtS2jaLPopv899QwFphiirmD_XWdqLatest Uploads: https://youtube.com/user/IISuperwomanII/videos?view=0&sort=dd&shelf_id=2 Thanks for watching and don't forget to keep smiling. You're worth it! xoxo"
"7uADLs1FIBI","Little Mix Sing Woman Like Me | Live Shows Week 2 | The X Factor UK 2018","2018-10-28T20:14:23.000Z","UCEY1ejsweY4DgMwOVJeEaBA","The X Factor UK","24","18.01.11","the x factor|x factor|X factor UK|x factor 2018|simon cowell|robbie williams|auditions judges season 15|series 15|X Factor UK 2018|X Factor 2018 audition|The x factor 2018|XFactor 2018|louis Tomlinson|Ayda Field|LITTLE MIX|JAYDE|JESSIE|THE X FACTOR LIVE SHOWS|PERRIE|JESY|JADE|LEIGH-ANNE","2305989","129033","2482","0","https://i.ytimg.com/vi/7uADLs1FIBI/default.jpg","True","False","Visit the official site: http://itv.com/xfactorLittle Mix provided the the inspiration for this year's finalists, returning to their old stomping ground to perform their new single Woman Like Me. A memorable Results Show performance, even though their collaborator, Nicki Minaj, didn't make the flight to the UK. SUBSCRIBE: http://bit.ly/TXFSubFacebook: http://bit.ly/TXFFBTwitter: http://bit.ly/TXFTwiDownload The X Factor mobile app: http://bit.ly/TXFappWatch full episodes on ITV Hub (UK ONLY): http://www.itv.com/hub/the-x-factor"
"WZwr2a_lFWY","IZ*ONE (아이즈원) - 라비앙로즈 (La Vie en Rose) MV","2018-10-29T09:00:05.000Z","UC_pwIXKXNm5KGhdEVzmY60A","Stone Music Entertainment","10","18.01.11","K-CULTURE korean Music MV Music Video K-Pop Kpop 뮤비 뮤직비디오|Stone Music Entertainment|IZ*ONE|아이즈원|라비앙로즈|La Vie en Rose|PRODUCE 48|아이즈원 뮤비|아이즈원 MV|IZ*ONE MV|IZ*ONE 뮤비|라비앙로즈 뮤비|라비앙로즈 MV|장원영|미야와키 사쿠라|야부키 나코|강혜원|이채연|김민주|김채원|최예나|안유진|혼다 히토미|조유리|권은비|La Vie en Rose MV|La Vie en Rose 뮤비|COLOR*IZ","7777735","425685","28512","71743","https://i.ytimg.com/vi/WZwr2a_lFWY/default.jpg","False","False","IZ*ONE (아이즈원) - 라비앙로즈 (La Vie en Rose) MV 입니다.‘IZ*ONE(아이즈원)’의 이름으로 선보이는 데뷔 미니 앨범 ＜COLOR*IZ(컬러라이즈)＞는 영단어로 ‘색칠을 입히다’라는 뜻을 가진 ‘Colorize’와 동일한 발음을 활용한 제목이다. 아이즈원은 데뷔 티저 영상에서 공개한 대로 멤버들 각각 대표색을 공개했다. 이 중 데뷔 앨범 ＜COLOR*IZ(컬러라이즈)＞는 ‘IZ*ONE(아이즈원)’의 열정을 가장 잘 형상화할 수 있는 컬러인 ‘RED’를 중심색으로 표현했고, ‘RED’를 가장 아름답고 정열적으로 표현할 수 있는 ‘ROSE’를 컨셉트로 잡아 앨범을 구성, 데뷔를 향한 멤버들의 소중한 꿈과 넘치는 열정을 보여줄 예정이다.특히 데뷔 미니 앨범의 타이틀곡 ‘라비앙로즈 (La Vie en Rose)’는 처음 공개되는 ‘IZ*ONE(아이즈원)’의 매력을 느낄 수 있는 곡으로, 강렬한 후렴구가 인상적이다. ‘장밋빛 인생’이라는 뜻의 제목처럼 아이즈원의 열정으로 너와 나, 그리고 우리 모두를 ‘장밋빛 인생’으로 만들겠다는 메시지를 담고 있다.뿐만 아니라 이번 앨범에는 ‘IZ*ONE(아이즈원)’의 아이덴티티를 가장 잘 보여줄 수 있는 상징적인 곡 ‘아름다운 색’을 시작으로 처음 느껴본 사랑이라는 감정을 Teen Dance 장르로 귀엽고 재치 있게 표현한 ‘O’ My!’, 웅장한 편곡 위에 아이즈원 멤버들의 따뜻한 감성을 전달한 동화같은 노래 ‘비밀의 시간’이 수록 됐다. 이외에도 지난 8월 Mnet ‘PRODUCE 48’ 에서 선보인 데뷔 평가곡 ‘앞으로 잘 부탁해’와 ‘반해버리잖아? (好きになっちゃうだろう？)’, 마지막화에서 공개된 단체곡 ‘꿈을 꾸는 동안’ , ‘PRODUCE48’의 메인 테마곡 ‘내꺼야’의 ‘IZ*ONE(아이즈원)’ 버전 등이 새롭게 수록 돼 ‘PRODUCE48’부터 아이즈원을 지켜본 이들이라면 새로운 매력을 느낄 수 있다. 데뷔 미니 앨범 ＜COLOR*IZ＞를  시작으로 아이즈원 멤버들이 전 세계를 향해 보여줄 12가지 색깔의 매력을 지켜 보자."
"D2O7LPnaU7I","TIME TO SHOOT THE TEAM 10 MOVIE!","2018-10-28T19:44:44.000Z","UCcgVECVN4OKV6DH1jLkqmcA","Jake Paul","22","18.01.11","jake|paul|logan|its|everyday|bro|team10|jerika|vlogs|jakepaulers|champion|erika|costell bizaardvark|edfluence|fanjoy|brothers|merch|link|in|bio|logang|family|friendly sherlock|love|you|can|it|bra|lamborghini|actor|daily|adventures|crazy|fortnite|killer|clown|justin|roberts|work|progress|episode|pnline|stream|reunion|back|old|members|tessa|brooks|nick|crompton","2472525","75346","25562","12833","https://i.ytimg.com/vi/D2O7LPnaU7I/default.jpg","False","False","SUBSCRIBE TO JUSTIN'S CHANNEL!!https://www.youtube.com/channel/UCdD2...👕GET MY NEW MERCH HERE BEFORE IT SELLS OUT 👕https://fanjoy.co/collections/jake-paul 🔵SPONSOR MY CHANNEL FOR EXCLUSIVE CONTENT & MORE 🔵https://www.youtube.com/user/JakePaulProductions/sponsorADD ME ON TWITCH ►https://www.twitch.tv/jakepaulgames🔔TURN ON MY POST NOTIFICATIONS FOR SHOUTOUTS IN MY VLOG➡️FOLLOW ME ON SOCIAL MEDIA! ⬅️INSTAGRAM ➤  https://www.instagram.com/JakePaul TWITTER ➤  http://twitter.com/JakePaul FACEBOOK ➤  https://www.facebook.com/JakePaul SNAPCHAT ➤  JakePaul19 MUSICAL.LY ➤  @JakePaul➡️FOLLOW TEAM 10! ⬅️Twitter ➝ http://twitter.com/Team10official Instagram ➝ http://instagram.com/Team10official Facebook ➝ http://instagram.com/Team10official Snapchat ➝ Team10SnapsMusical.ly ➝ @Team10officialWant to text us?  ➝ 1-323-909-4406📗I HAVE A BOOK!! “YOU GOTTA WANT IT 📗 http://amzn.to/2hY5Pyx⚠️ WARNING ⚠️Some effects and visuals may not be suitable for those that suffer from epilepsy.#JakePaul #Team10 #ItsEverydayBro"
"8qRm2McjE9k","UFC 230 Embedded: Vlog Series - Episode 1","2018-10-29T22:16:40.000Z","UCvgfXK4nTYKudb0rFR6noLA","UFC - Ultimate Fighting Championship","17","18.01.11","ufc|230|embedded|world|heavyweight|championship|champion|champ|title|daniel|dc|cormier|derrick|black|beast|lewis|chris|all-american|weidman|ronaldo|jacare|souza|york|city|nyc|mma|bjj|mixed|martial|arts|ultimate|fighting|madison|square|garden|matt|serra|new|jiu|jitsu|bts|behind|the|scenes","588229","7728","181","1698","https://i.ytimg.com/vi/8qRm2McjE9k/default.jpg","False","False","On Episode 1 of UFC 230 Embedded, two-division champion Daniel Cormier readies himself for a uniquely fearless opponent; heavyweight title challenger Derrick Lewis trains for another knockout win. Former middleweight champion Chris Weidman zeroes in on BJJ under his longtime coach, UFC Hall of Famer Matt Serra. Middleweight foe Jacare Souza anticipates a champion versus champion caliber matchup. Lewis feels the spotlight at a local Rockets game, and Cormier decorates pumpkins with his family. UFC 230 Embedded is an all-access, behind-the-scenes video blog leading up to the heavyweight title fight taking place Saturday, November 3 on Pay-Per-View. SUBSCRIBE to get all the latest UFC content: https://www.youtube.com/ufcConnect with UFC Online and on SocialWebsite: http://www.ufc.comFollow UFC Twitter: http://www.twitter.com/ufcFacebook: http://www.facebook.com/ufcInstagram: http://www.instagram.com/ufcSnapchat: UFCPeriscope: http://Periscope.tv/ufcFollow Daniel “DC” CormierTwitter https://twitter.com/dc_mmaFacebook https://www.facebook.com/danielcormiermmaInstagram https://www.instagram.com/dc_mma/Follow Derrick “The Black Beast” LewisTwitter https://twitter.com/Thebeast_ufcFacebook https://www.facebook.com/Derrick-The-Black-Beast-Lewis-1468249886760868/Instagram https://www.instagram.com/Thebeastufc/ Follow Chris “The All-American” WeidmanTwitter https://twitter.com/ChrisWeidmanUFCInstagram https://www.instagram.com/chrisweidmanufc/Facebook https://www.facebook.com/chrisweidmanufc/Follow Ronaldo Jacare SouzaTwitter https://twitter.com/JacareMMAInstagram https://www.instagram.com/ronaldojacareFacebook https://www.facebook.com/RonaldoJacareSouza About UFC®UFC® is a premium global sports brand and the largest Pay-Per-View event provider in the world. Celebrating its 25th Anniversary in 2018, UFC boasts more than 284 million fans worldwide and has produced over 440 events in 22 countries since its inception in 1993. Acquired in 2016 by global sports, entertainment and fashion leader Endeavor (formerly WME | IMG), together with strategic partners Silver Lake Partners and KKR, UFC is headquartered in Las Vegas with a network of employees around the world. UFC produces more than 40 live events annually that consistently sell out some of the most prestigious arenas around the globe, while programming is broadcast in over 160 countries and territories to 1.1 billion TV households worldwide in 40 different languages. UFC FIGHT PASS®, a digital subscription service, delivers exclusive live events, thousands of fights on-demand and original content to fans around the world. For more information, visit UFC.com and follow UFC at Facebook.com/UFC, Twitter, Snapchat and Instagram: @UFC."
