video_id,title,publishedAt,channelId,channelTitle,categoryId,trending_date,tags,view_count,likes,dislikes,comment_count,thumbnail_link,comments_disabled,ratings_disabled,description
"JIFMN986m8s","Worst Halloween Candy Taste Test (Day 3)","2018-10-31T10:00:03.000Z","UC4PooiX37Pld1T8J5SYT-SQ","Good Mythical Morning","24","18.01.11","gmm|good mythical morning|rhettandlink|rhett and link|mythical morning|mythical|rhett|link|season 14|gmm candy|gmm candy tournament|good mythical morning candy|good mythical morning candy tournament|halloween|candy|halloween candy|worst halloween candy|taste test|taste|test|gmm tournament|good mythical morning tournament|clash of the crappy candies|munch madness|gmm munch madness|rhett and link candy|Worst Halloween Candy Taste Test (Day 3)","1054156","39129","1236","10153","https://i.ytimg.com/vi/JIFMN986m8s/default.jpg","False","False","We've arrived at the finals! Which of our Ehh Eight will be crowned the crappiest candy? Tune into LTAT on Saturday to see how the Mythical Crew's brackets fared! GMM #1412Watch today's GMMore: https://youtu.be/L6SmOn2dRhkWant more GMM? Watch this season from the start: http://bit.ly/GMM_S14Pick up official GMM and Mythical merch at https://mythical.storeand https://www.amazon.com/mythicalDon’t miss our weekly podcast, Ear Biscuits: https://applepodcasts.com/earbiscuitsFollow Rhett & Link: Instagram: https://instagram.com/rhettandlinkFacebook: https://facebook.com/rhettandlinkTwitter: https://twitter.com/rhettandlinkWebsite: https://mythical.com/Check Out Our Other Mythical Channels:Good Mythical MORE: https://youtube.com/goodmythicalmoreRhett & Link: https://youtube.com/rhettandlinkMythical: https://youtube.com/thisismythicalWant to send us something? https://mythical.com/contactSubmit your Wheel of Mythicality intro video here: https://bit.ly/GMMWheelIntroIntro Animation by Digital Twigs: https://www.digitaltwigs.comIntro & Outro Music by Jeff Zeigler & Sarah Schimeneck https://www.jeffzeigler.comSupplemental Music from Extreme Production Music: https://www.extrememusic.com/Mic: ‘The Mouse’ by Blue Microphones https://www.bluemic.com/mouse/"
"0iy3HPxBFQY","James Corden & Ariana Grande Visit an Escape Room","2018-10-31T05:01:11.000Z","UCJ0uqCI0Vqr2Rrt1HseGirg","The Late Late Show with James Corden","24","18.01.11","The Late Late Show|Late Late Show|James Corden|Corden|late night|late night show|comedy|comedian|celebrity|celeb|celebrities|CBS|joke|jokes|funny|funny videos|funny video|humor|hollywood|famous|ariana grande|haunted house|escape room|ariana hurt wrist|ariana wrist|ariana grande escape room","896693","49252","289","2247","https://i.ytimg.com/vi/0iy3HPxBFQY/default.jpg","False","False","Since Ariana Grande loves Halloween and being scared, James takes her to a haunted escape room and they both are terrified while trying to get out. Thank you to 60OUT Escape Rooms. Learn more about visiting one: https://www.60out.com/More Late Late Show:Subscribe: http://bit.ly/CordenYouTubeWatch Full Episodes: http://bit.ly/1ENyPw4Facebook: http://on.fb.me/19PIHLCTwitter: http://bit.ly/1Iv0q6kInstagram: http://bit.ly/latelategramWatch The Late Late Show with James Corden weeknights at 12:35 AM ET/11:35 PM CT. Only on CBS.Get new episodes of shows you love across devices the next day, stream live TV, and watch full seasons of CBS fan favorites anytime, anywhere with CBS All Access. Try it free! http://bit.ly/1OQA29B---Each week night, THE LATE LATE SHOW with JAMES CORDEN throws the ultimate late night after party with a mix of celebrity guests, edgy musical acts, games and sketches. Corden differentiates his show by offering viewers a peek behind-the-scenes into the green room, bringing all of his guests out at once and lending his musical and acting talents to various sketches. Additionally, bandleader Reggie Watts and the house band provide original, improvised music throughout the show. Since Corden took the reigns as host in March 2015, he has quickly become known for generating buzzworthy viral videos, such as Carpool Karaoke."
"csdpfoCZWQM","GLOOM TRIES CUPPING FOR THE FIRST TIME","2018-10-30T19:02:56.000Z","UC6IijBsVf2PlWo_uq6P9wQw","Gloom","24","18.01.11","i tried cupping|cupping|what is cupping|chinese medicine|chinese traditional medicine|cupping massage|cupping therapy|fire cupping|gloom|gloomgames|kassie|2018|gloom tries cupping for the first time|cupping session|health|therapy|funny","351785","17879","386","2788","https://i.ytimg.com/vi/csdpfoCZWQM/default.jpg","False","False","I've been experimenting with Traditional Chinese Medicine lately and really wanted to try fire cupping for my poor stiff back. 10/10 would silently freak out again, hbu?SUBSCRIBE HERE: https://www.youtube.com/channel/UC6IijBsVf2PlWo_uq6P9wQw?sub_confirmation=1My INSTAGRAM: http://www.instagram.com/gloomykassieMy TWITTER: http://www.twitter.com/gloomykassieWatch Videos with ITSFUNNEH: https://www.youtube.com/watch?v=AkmU167NilM&list=PLwbhb6Gu7AnWV6Qo5CmMr-VNVywWV93JNWatch some of my favourite videos here: https://www.youtube.com/playlist?list=PLwbhb6Gu7AnXZPY5Yl1gNgxWVpL12SJhUThe Best of Chinese Medicine in Toronto: https://bestofchinesemedicine.com---------------------------------------------------------------------------I'm Kassie, also known as Gloom! I'm a variety gamer who does gameplay commentary on indie games and some bigger titles too. I also do silly sketches, challenges, Q&As, and whatever makes my Nimble Wimble's smile. Let's explore virtual worlds and have some laughs!I do my best to upload at a few times a week (unless my life is a mess). ---------------------------------------------------------------------------"
"XeAClxSYQc8","Ellen's Backstage Scares Featuring Kris Jenner, Ciara and Her Staff","2018-10-31T13:00:04.000Z","UCp0hYYBW6IMayGgR-WeoCvQ","TheEllenShow","24","18.01.11","scare|montage|ellen staff|tv|kris jenner|ciara|ellen degeneres|ellen|the ellen degeneres show|ellen show|ellentube|who is on ellen today|season 16|season 16 episode 41|scares|ellen's scares|behind the scenes|ellen backstage|halloween scare|kris jenner scare|kris jenner scared|kris jenner falling|kardashians|ciara scared|ellen's staff scare|ellen's producers|hilarious|funny|ellen's best scares|backstage scares|kylie|kendall|kim|ciara on ellen","408612","18862","207","0","https://i.ytimg.com/vi/XeAClxSYQc8/default.jpg","True","False","One of Ellen's favorite parts of Halloween is scaring her staff. This season, she set up an empty TV box and waited for unsuspecting employees (and a couple of celebrities) to walk by.#TheEllenShow#Scares#Halloween"
"YyWru2XOiK0","Tyga - Dip (Official Video) ft. Nicki Minaj","2018-10-29T19:00:49.000Z","UChXnu0HBydqedqhnClp0rJg","TygaVEVO","10","18.01.11","Tyga|Dip|(Official|Video)|Last|Kings|Music|EMPIRE|Hip|Hop/Rap|Make It Dip|Remix|Nicki Minaj|Official|Music Video|VEVO|Taste|Michael Jackson|Janet Jackson|Scream|Voodoo Doll|Cardi B","5318708","252922","14229","24324","https://i.ytimg.com/vi/YyWru2XOiK0/default.jpg","False","False","Download the new single, DIP. Out Now!Stream: https://EMPIRE.lnk.to/DipNickiYoDirected by: Tyga & ArradVideo Produced by: Riveting EntertainmentSong produced by: d.a. domanStudio Personnel, Engineer: Christian CQ QuinonezStudio Personnel, Mixer: Jaycen JoshuaOfficial Music Video by Tyga performing Dip featuring Nicki Minaj © 2018 Last Kings Music / EMPIRE#DIP #Tyga #NickiMinajhttp://vevo.ly/EXTR0M"
"U68MJz9DrI4","Gucci Mane, Bruno Mars, Kodak Black - Wake Up in The Sky [Official Music Video]","2018-10-31T14:17:10.000Z","UCSugZEYrWbzqIWGD195V-YA","OfficialGucciMane","10","18.01.11","officialguccimane|gucci mane|gucci|mane|atlantic records|atlantic|guwop|radric davis|hip hop|rap|i get the bag|both|curve|met gala|solitaire|real rich|el gato|mr. davis|droptopwop|atlanta|DN6WWu_KEQs|UdvpUjCmLC4|Wake Up In The Sky|Bruno Mars|Kodak Black|Music Video|Official Music Video|mjaayCARwro|zcWqllTtns4|gucci mane bruno mars kodak black|smoke til I'm high|drink til I'm drunk|You cant tell me I aint fly|I know Im super fly|wuits|gucci bruno kodak","673533","91342","1480","8204","https://i.ytimg.com/vi/U68MJz9DrI4/default.jpg","False","False","The official music video for Gucci Mane, Bruno Mars, and Kodak Black’s “Wake Up In The Sky” – available now!Stream/Download - https://guccimane.lnk.to/WakeUpInTheSkyAYDirector: Bruno Mars & Florent DechardProduced By Jeremy SullivanSubscribe for more official content from Gucci Mane:https://Atlantic.lnk.to/GMsubscribeFollow Gucci Manehttp://GucciManeOnline.comhttp://Twitter.com/Gucci1017http://Facebook.com/GucciManehttp://Instagram.com/LaFlare1017Follow Bruno Marshttp://www.brunomars.comhttp://www.instagram.com/brunomarshttp://www.twitter.com/brunomarshttp://www.facebook.com/brunomarsFollow Kodak Blackhttps://officialkodakblack.com/https://twitter.com/KodakBlack1khttps://facebook.com/TheRealKodakBlackhttps://instagram.com/kodakblackhttps://soundcloud.com/kodak-blackThe official YouTube channel of Atlantic Records artist Gucci Mane. Subscribe for the latest music videos, performances, and more.#gucci #kodak #bruno #guccimane #brunomars #kodakblack #WakeUpInTheSky #WUITS #MusicVideo #AtlanticRecords #atlantic"
"Ppy8qbOW5R0","Musical Shopping | Rudy Mancuso","2018-10-30T20:30:12.000Z","UC5jkXpfnBhlDjqh0ir5FsIQ","Rudy Mancuso","10","18.01.11","Musical Shopping | Rudy Mancuso|rudymancuso|musical|shopping|musical shopping|anwar|lelepons|hannahstocking|anitta|brazil|alesso|celoso|iphone xs by pineapple|superhero therapy|lento","687596","54691","1429","4529","https://i.ytimg.com/vi/Ppy8qbOW5R0/default.jpg","False","False","Thank you @target for sponsoring this video. #TargetMyWay #Tarzhay #adWATCH MORE ▶ https://youtu.be/aP0bKcsSNuASUBSCRIBE ► https://www.youtube.com/channel/UC5jkXpfnBhlDjqh0ir5FsIQ?sub_confirmation=1THANKS FOR WATCHING! LIKE & SUBSCRIBE FOR MORE VIDEOS!-----------------------------------------------------------FIND ME ON: Instagram | http://instagram.com/rudymancusoTwitter | http://twitter.com/rudymancusoFacebook | http://facebook.com/rudymancusoCAST: Rudy Mancuso | http://youtube.com/c/rudymancusoFOLLOW THE SHOTS FAMILY ▶ http://instagram.com/theshotsfamilyShots Studios Channels:Alesso | http://youtube.com/c/alessoAnitta | http://youtube.com/c/anittaAnwar Jibawi | http://youtube.com/c/anwarAwkward Puppets | http://youtube.com/c/awkwardpuppetsDelaney Glazer | http://youtube.com/c/deeglazerHannah Stocking | http://youtube.com/c/hannahstockingLele Pons | http://youtube.com/c/leleponsMarlon Wayans | http://youtube.com/c/marlonwayansRudy Mancuso | http://youtube.com/c/rudymancusoShots Studios | http://youtube.com/c/shotsThe Shots Family [Vertical] | http://youtube.com/c/theshotsfamily#Rudy#RudyMancuso"
"L6SmOn2dRhk","Embarrassing Halloween Costumes","2018-10-31T10:00:05.000Z","UCzpCc5n9hqiVC7HhPwcIKEg","Good Mythical MORE","24","18.01.11","gmm|good mythical morning|rhettandlink|rhett and link|mythical morning|mythical|rhett|link|season 14|embarrassing halloween costumes|halloween|halloween costumes|gmmore|good mythical more|gmm more|rhett and link costumes|clash of the crappy candies|clash of the crappy candy|worst halloween candy|worst halloween candy tournament|costumes|embarrassing|mythical crew|gmm crew more|gmmore crew|gmmore crew game|gmmore game|good mythical more crew","183599","6304","40","451","https://i.ytimg.com/vi/L6SmOn2dRhk/default.jpg","False","False","Which member of the Mythical Crew spent a night as the Target Dog? We're guessing who wore these embarrassing costumes!  GMMore #1412Watch today's GMM: https://youtu.be/JIFMN986m8sWant more GMM? Watch this season from the start: http://bit.ly/GMM_S14Pick up official GMM and Mythical merch at https://mythical.storeand https://www.amazon.com/mythicalDon’t miss our weekly podcast, Ear Biscuits: https://applepodcasts.com/earbiscuitsFollow Rhett & Link: Instagram: https://instagram.com/rhettandlinkFacebook: https://facebook.com/rhettandlinkTwitter: https://twitter.com/rhettandlinkWebsite: https://mythical.com/Check Out Our Other Mythical Channels:Good Mythical Morning: https://youtube.com/goodmythicalmorningRhett & Link: https://youtube.com/rhettandlinkMythical: https://youtube.com/thisismythicalWant to send us something? https://mythical.com/contactSubmit your Wheel of Mythicality intro video here: https://bit.ly/GMMWheelIntroIntro Animation by Digital Twigs: https://www.digitaltwigs.comIntro & Outro Music by Jeff Zeigler & Sarah Schimeneck https://www.jeffzeigler.comSupplemental Music from Extreme Production Music: https://www.extrememusic.com/Mic: ‘The Mouse’ by Blue Microphones https://www.bluemic.com/mouse/"
"ZAfAud_M_mg","Halsey - Without Me","2018-10-29T15:58:23.000Z","UCm3FgJ2Hqm7tb70T-GfwXVA","HalseyVEVO","10","18.01.11","halsey without me|halsey|without me|halsey alone|halsey eastside|eastside|hfk|hopeless fountain kingdom|halsey bad at love|bad at love|now or never|halsey now or never|halsey him & i|halsey strangers","4467893","297950","6369","15626","https://i.ytimg.com/vi/ZAfAud_M_mg/default.jpg","False","False","Without Me available now: https://halsey.lnk.to/WithoutMeYDlisten on Spotify: https://halsey.lnk.to/WithoutMeYD/spotifylisten on Apple Music: https://halsey.lnk.to/WithoutMeYD/applemusicbuy on iTunes: https://halsey.lnk.to/WithoutMeYD/iTunesget it on Amazon Music: https://halsey.lnk.to/WithoutMeYD/amazonget it on Google Play: https://halsey.lnk.to/WithoutMeYD/google-playwatch more Halsey videos: https://halsey.lnk.to/officialvideosYDFollow Halseyhttp://iamhalsey.comhttp://twitter.com/halseyhttps://www.facebook.com/HalseyMusichttp://instagram.com/iamhalsey#halsey #withoutme #musicvideoMusic video by Halsey performing Without Me. © 2018 Capitol Records, LLChttp://vevo.ly/YdY0Dx"
"hs1HoLs4SD0","Introducing the new MacBook Air — Apple","2018-10-30T14:21:50.000Z","UCE_M8A5yxnLfW0KghEeajjw","Apple","28","18.01.11","Apple|MacBook Air|Retina display|Touch ID|dual core processors|butterfly keyboard|thin|light|T2 Security Chip|recycled aluminum|sustainable|green|eco-friendly|environment","2755746","74180","10611","0","https://i.ytimg.com/vi/hs1HoLs4SD0/default.jpg","True","False","The new MacBook Air brings many of our most advanced technologies to this iconic design for the first time — including a brilliant Retina display, Touch ID, a powerful eighth-generation Intel Core i5 processor, the latest-generation butterfly keyboard, and the Apple T2 Security Chip. And with an enclosure made with 100% recycled aluminum, it’s the greenest Mac ever.Learn more at https://apple.co/2OhVx9f"
"Fd7BrGUSxqQ","2019 iPad Pro Impressions: Incredibly Thin!","2018-10-30T21:35:21.000Z","UCBJycsmduvYEL83R_U4JriQ","Marques Brownlee","28","18.01.11","iPad Pro|new iPad Pro|Apple iPad Pro.|iPad Pro impressions|iPad Pro hands on|iPad Pro review|2019 iPad Pro|MKBHD|iPad Pro 12.9|iPad Pro 11|Retina iPad|iPad Pro new|iPad|the new iPad|new iPad Pro 12.9|ProMotion","2252418","75942","1789","10228","https://i.ytimg.com/vi/Fd7BrGUSxqQ/default.jpg","False","False","The new iPad Pro widens the gap between itself and every other tablet.3rd generation iPad Pro: https://apple.com/ipad-pro/MKBHD Merch: http://shop.MKBHD.comVideo Gear I use: http://kit.com/MKBHD/video-gear#recommendation17959Tech I'm using right now: https://www.amazon.com/shop/MKBHDIntro Track: Filet Mignon by The Cutlery~http://twitter.com/MKBHDhttp://snapchat.com/add/MKBHDhttp://google.com/+MarquesBrownleehttp://instagram.com/MKBHDhttp://facebook.com/MKBHD"
"BahtnT13vH8","Imagine Dragons - Machine (Audio)","2018-10-31T16:30:00.000Z","UCpx_k19S2vUutWUUM9qmXEg","ImagineDragonsVEVO","10","18.01.11","Imagine|Dragons|Machine|(Audio)|Kid|Ina|Korner|Interscope|Alternative","1075599","165371","1345","16237","https://i.ytimg.com/vi/BahtnT13vH8/default.jpg","False","False","Listen to Machine, out now: http://smarturl.it/MachineIDPre-order the upcoming album Origins, out 11/9: http://smarturl.it/OriginsIDShop Imagine Dragons: http://smarturl.it/ImagineDragonsShopSign up for email updates: http://smarturl.it/ID_EmailListen to Imagine Dragons on Spotify: http://smarturl.it/ID_DiscographyCatch Imagine Dragons on tour: http://imaginedragonsmusic.com/tourFollow Imagine Dragons:Facebook: https://www.facebook.com/ImagineDragonsTwitter: https://twitter.com/ImaginedragonsInstagram: https://www.instagram.com/imaginedragonsLYRICSAll of my lifeI’ve been sitting at the tableWatching them kids their living in a fableLooks, luck, money and never left a’wishinBut now it’s about time to raise up and petitionAll of my lifeI’ve been sitting at the tableWatching them kids living in a fableLooks, luck, money and never left a’wishinBut now it’s about time to stand up and petitionCause I’ve been wonderingWhen you’re gonna see I’m not for saleI’ve been questioningWhen you’re gonna see I’m not a part of your machineNot a part of your machineI’m not scared of what you’re gonna tell meNo I’m not scared of the beast in the bellyFill my cup with endless ambitionAnd paint this town with my very own visionI’m not scared of what you’re gonna tell meAnd I’m not scared of the beast in the bellyFill my cup with endless ambitionAnd paint this town with my very own visionCause I’ve been wonderingWhen you’re gonna see I’m not for saleI’ve been questioningWhen you’re gonna see I’m not a part of your machineNot a part of your machineI am the machineI am the machineCause I’ve been wonderingWhen you gonna see I’m not for saleI’ve been questioningWhen you’re gonna see I’m not a part of your machineNot a part of your machineCause I’ve been wonderingWhen you’re gonna see I’m not for saleI’ve been questioningWhen you’re gonna see I’m not a part of your machineNot a part of your machineI am the machineMusic video by Imagine Dragons performing Machine (Audio). © 2018 KIDinaKORNER/Interscope Recordshttp://vevo.ly/nd42xf"
"mUBMPaj0L3o","ROSALÍA - DI MI NOMBRE (Cap.8: Éxtasis)","2018-10-30T16:00:09.000Z","UCy2bCk5KnIfjmWYFHMZcd5w","RosaliaVEVO","10","18.01.11","rosalia|rosalia di mi nombre|video rosalia|di mi nombre video oficial|pop|flamenco|DI MI NOMBRE|Pop|ROSALÍA|Sony Music Entertainment","1188373","57501","3108","3588","https://i.ytimg.com/vi/mUBMPaj0L3o/default.jpg","False","False","ROSALÍA - Di mi nombre (Official Video)Download & stream “Di mi nombre”: Spotify: https://ROSALIA.lnk.to/DiMiNombreAY/spotifyiTunes: https://ROSALIA.lnk.to/DiMiNombreAY/itunesApple Music: https://ROSALIA.lnk.to/DiMiNombreAY/applemusicDeezer: https://ROSALIA.lnk.to/DiMiNombreAY/deezerFollow ROSALÍA: Instagram: https://www.instagram.com/rosalia.vt/ Twitter: https://twitter.com/rosaliavt Facebook: https://www.facebook.com/musicarosaliabarcelona/Spotify: https://open.spotify.com/artist/7ltDVBr6mKbRvohxheJ9h1?si=LJI253ChSdms6o-GulnEpwOfficial site: https://rosalia.com/Directed by Henry ScholfieldChoreography by Charm La DonnaProduced by Caviar"
"gap2WssoxWc","Keira Knightley & Mackenzie Foy Answer the Web's Most Searched Questions | WIRED","2018-10-30T16:01:09.000Z","UCftwRNsjfRo08xYE31tkiyw","WIRED","24","18.01.11","keira knightley|mackenzie foy|wired autocomplete interview|keira knightley interview|keira knightley autocomplete|autocomplete interview|keira knightley wired autocomplete|mackenzie foy interview|mackenzie foy autocomplete|mackenzie foy autocomplete interview|mackenzie foy twilight|keira knightley funny|keira knightley funny moments|keira knightley interview 2018|keira knightley the nutcracker|wired","193411","6733","106","602","https://i.ytimg.com/vi/gap2WssoxWc/default.jpg","False","False","The Nutcracker and the Four Realms stars Keira Knightley and Mackenzie Foy take the WIRED Autocomplete Interview and answer the internet's most searched questions about themselves. Does Keira Knightley have a baby? Is Mackenzie Foy related to Claire Foy? Where did Keira Knightley grow up? Still haven’t subscribed to WIRED on YouTube? ►► http://wrd.cm/15fP7B7 

Also, check out the free WIRED channel on Roku, Apple TV, Amazon Fire TV, and Android TV. Here you can find your favorite WIRED shows and new episodes of our latest hit series Masterminds.

ABOUT WIRED
WIRED is where tomorrow is realized. Through thought-provoking stories and videos, WIRED explores the future of business, innovation, and culture.Keira Knightley & Mackenzie Foy Answer the Web's Most Searched Questions | WIRED"
"UYAnkdhe9KE","Honest Trailers - Batman: The Animated Series","2018-10-30T17:00:04.000Z","UCOpcACMWblDls9Z6GERVi1A","Screen Junkies","1","18.01.11","screenjunkies|screen junkies|honest trailers|honest trailer|honest trailers batman|honest trailers batman the animated series|batman|batman the animated series|batman trailer|batman the animated series trailer|batman cartoon|kevin conroy batman|batman 90's cartoon|batman 90's animated series|honest trailers dc|batman dc|dc animated series|90's cartoons","1078411","43937","611","6316","https://i.ytimg.com/vi/UYAnkdhe9KE/default.jpg","False","False","Before he was swole, before he was depressed, before he was a cartoon, he was a swole depressed cartoon - it's Batman: The Animated SeriesWatch the Honest Trailers Commentary to see an inside look from the writer's perspective!https://www.youtube.com/watch?v=iYnJa-ssCkYVoiceover Narration by Jon BaileyTitle Design: Robert HoltbyWritten by Spencer Gilbert, Dan Murrell, Joe Starr, Lon HarrisProduced by Spencer Gilbert, Dan Murrell, Joe Starr & Max DionneEdited by Kevin Williamsen and TJ NordakerAssistant Editor: Emin BassavandHonest Trailers - Batman: The Animated Series"
"SgZ1f4ACZBQ","Who Owns The Statue of Liberty?  (New Jersey vs New York)","2018-10-30T14:23:07.000Z","UC2C_jShtL725hvbm1arSV9w","CGP Grey","27","18.01.11","cgpgrey|education|new york|new jersey|statue of liberty|history","1003601","63178","457","6578","https://i.ytimg.com/vi/SgZ1f4ACZBQ/default.jpg","False","False","Bizarre borders part 4!Discuss this video: https://old.reddit.com/r/CGPGrey/comments/9son6t/who_owns_the_statue_of_liberty/Wallpapers on Patreon: https://www.patreon.com/posts/project-liberty-22392131Special thanks:  Jameson W. Doig, Professor Emeritus, Princeton University.Thank you to my supporters on Patreon:Thomas J Miller Jr MD, James Bissonette, Bob Kunz, John Buchan, Nevin Spoljaric, Chris Chapin, Richard Jenkins, Tony DiLascio, Donal Botkin, Phil Gardner, Christian Cooper, Michael Little, Martin, Steven Grimm, Ø³Ù„ÙŠÙ…Ø§Ù† Ø§Ù„Ø¹Ù‚Ù„, Saki Comandao, Jason Lewandowski, Michael Mrozek, Kozo Ota, Faust Fairbrook, Colin Millions, Cas EliÃ«ns, Ian, rictic, Guillermo, JoJo Chehebar, Derek Bonner, Derek Jackson, Mikko, Orbit_Junkie, Ron Bowes, TÃ³mas Ãrni JÃ³nasson, Christopher Anthony, Richard Comish, Oliver Steele, Andrea Di Biagio, David F Watson, Michael Cao, Andrew Proue, Bear, chrysilis, Dag Viggo LokÃ¸en, David Palomares, Edward Adams, Emil, Erik Parasiuk, Esteban Santana Santana, Freddi HÃ¸rlyck, Jacob Ostling, John Rogers, ken mcfarlane, Kevin Anderson, Leon, Maarten van der Blij, Paul Tomblin, Peter Lomax, Rescla, Rhys Parry, ShiroiYami, Tijmen van Dien, Tristan Watts-Willis, Veronica Peshterianu, Ernesto Jimenez, John Lee, Maxime Zielony, Osric Lord-Williams, Ben Schwab, Roman Pinchuk, and Elizabeth Keathley.https://www.patreon.com/cgpgreyMusic by: http://www.davidreesmusic.com"
