video_id,title,publishedAt,channelId,channelTitle,categoryId,trending_date,tags,view_count,likes,dislikes,comment_count,thumbnail_link,comments_disabled,ratings_disabled,description
"Xucir4b8-ZQ","Battle to Throw First Pitch at the World Series vs. Guava Juice!!","2018-10-24T21:15:13.000Z","UCaRH3rDr3K3CEfhVqu5mgUQ","Team Edge","23","18.01.11","team edge|teamedge|YouTube TV|MLB World Series 2018|first pitch at the world series|team edge challenge|youtubetv|youtube tv|YouTubeTV|MLB|World Series|2018 world series|World Series 2018|baseball|base ball|major league baseball|mlb 2018|baseball 2018|postseason|WS|WS 2018|battle|competition|challenges","1677577","25927","1237","3282","https://i.ytimg.com/vi/Xucir4b8-ZQ/default.jpg","False","False","Hey guys! Big thanks to #YouTubeTV for sponsoring the competition! #sponsored. We took on Guava Juice in 3 EPIC baseball-inspired competitions to try & win a chance to throw out the honorary FIRST PITCH at Game 4 of the 2018 #WorldSeries! Can you guess who will win? Let us know down below!Watch the World Series now on YouTube TV:  https://goo.gl/5xxLkz Check out Guava Juice’s version of the video here: https://youtu.be/cDZi1G8MgxQSpecial shoutout to the MLB Youth Academy—We had so much fun shooting this video there!Produced by our friends at Portal A🔽MORE LINKS BELOW 🔽Team Edge Merchandise! ➡ https://teamedge.store/collections/papayaSubscribe To Team Edge! ➡ https://www.youtube.com/channel/UCaRH3rDr3K3CEfhVqu5mgUQMore Team Edge Challenge Videos! Season 1 Challenges! ➡ https://www.youtube.com/playlist?list=PLdU_QLI5aP--e4DyT2Cler5W1PpKLWwQ_Season 2 Challenges! ➡ https://www.youtube.com/playlist?list=PLdU_QLI5aP--2XBT-sdKQtkQjyHT3TxgtThe Edge Games San Diego 2016 ➡ https://www.youtube.com/playlist?list=PLdU_QLI5aP--58zK687Fn4_3-MObiefJNMatthias ➡ https://www.youtube.com/user/matthiasiam?sub_confirmation=1J-Fred ➡ https://www.youtube.com/user/mrjollywhitegiantBryan ➡ https://www.youtube.com/playlist?list=PLZPssQhdLX_8JS7ohhNNrkrBpTdgJHB1B&disable_polymer=trueOn this channel, you'll see a bunch of family friendly, kid friendly fun challenges, board games, toys, bottle flipping, giant sports, gross food tasting, messy challenges, nerf challenges, and more!Mail Box:24307 Magic Mtn Pkwy #211Valencia, CA 91355Twitter ➡ https://goo.gl/rbKKmGInstagram  ➡ https://instagram.com/itsteamedge/Challenges ➡ Tuesday - Friday"
"i2pDsCk01F4","Cops Hunt for Robber Who Looks Just Like 'Friends' Star David Schwimmer","2018-10-24T17:35:55.000Z","UC9k-yiEpRHMNVOnOi_aQK8w","Inside Edition","25","18.01.11","ross geller sandwich|ross geller holiday armadillo|inside_edition|friends episodes|ie offbeat|entertainment|celebrity|leigh scheps|friends|inside edition|friends lines|viral|cat-offbeat|offbeat|ross geller","429674","9710","251","976","https://i.ytimg.com/vi/i2pDsCk01F4/default.jpg","False","False","Police who turned to social media for help catching a thief got more than they bargained for when users noticed the suspect's distinct resemblance to Ross Geller from Friends. Reaction to a Facebook post by Blackpool Police in England was swift, with people immediately noting the similarity to actor David Schwimmer. The One Where Ross Became a Thief, read one comment. InsideEdition.com's Leigh Scheps (http://twitter.com/LeightTVReporter) has more."
"V1weVGUmNTA","P!nk & Willow Sage Hart (P!nk’s Daughter) - A Million Dreams/A Million Dreams (Reprise)","2018-10-24T13:00:03.000Z","UCe4LM_eKc9ywRmVuBm5pjQg","Atlantic Records","10","18.01.11","pink|a million dreams|willow sage hart|pink's daughter|pink willow|willow pink|p!nk|atlantic|atlantic records|official music video|the greatest showman|greatest showman|a million dreams pink|pink a million dreams|p!nk a million dreams|a million dreams p!nk|a million dreams (reprise)|pink studio bts|pink daughter greatest showman|greatest show|a million dreams are keeping me awake|greatest showman on earth","7500991","239573","1002","6152","https://i.ytimg.com/vi/V1weVGUmNTA/default.jpg","False","False","P!nk and her daughter Willow Sage Hart sing A Million Dreams and A Million Dreams (Reprise) from The Greatest Showman: Reimagined. Download/Stream A Million Dreams & A Million Dreams (Reprise) now: https://Atlantic.lnk.to/TGS_ReimaginedIDPre-Order The Greatest Showman: Reimagined now: https://Atlantic.lnk.to/TGS_ReimaginedID'The Greatest Showman Soundtrack' available now:Download/Stream - https://atlantic.lnk.to/TheGreatestShowmanID Subscribe for more official content from Atlantic Records:https://Atlantic.lnk.to/subscribeFollow The Greatest Showmanhttps://twitter.com/GreatestShowmanhttps://facebook.com/GreatestShowmanhttps://instagram.com/greatestshowmanFollow Atlantic Recordshttps://facebook.com/atlanticrecordshttps://instagram.com/atlanticrecordshttps://twitter.com/AtlanticRecordshttp://atlanticrecords.com The official Atlantic Records YouTube Channel is home to the hottest in hip-hop, rock, pop, R&B, indie, musicals and soundtracks. With over 70 years of global recorded music history, Atlantic Records’ legacy and passion for artistry continues with Top 40 hitmakers like Wiz Khalifa, Sean Paul, Trey Songz, Bruno Mars, Charlie Puth, Janelle Monáe, and B.o.B. Atlantic Records prides itself for working on Motion Picture Soundtracks, such as “The Greatest Showman”, “Suicide Squad” and “The Fate of the Furious.” As well as Musical Soundtracks including “Dear Evan Hansen,” and Grammy and Tony Award Winning “Hamilton”. It is home to world-renowned record labels representing music from every genre, including Asylum, Big Beat, Canvasback, Elektra, Fueled By Ramen, Rhino, Roadrunner, and Sire. Subscribe for the latest official music videos, official audio videos, performances, bts and more from our artists and projects.https://Atlantic.lnk.to/subscribe#Pink #AMillionDreams #GreatestShowman #AtlanticRecords #Atlantic"
"ienN28M-KAg","EPIC HALLOWEEN COSTUMES! - Cheap, Fun and Easy DIY = Under $10!","2018-10-24T23:18:34.000Z","UCHu2KNu6TtJ0p4hpSW7Yv7Q","Draw with Jazza","26","18.01.11","josiah|brooks|jazza|jazzastudios|animation|game design|media|newgrounds|armor games|flash|humor|drawing|how to draw|adobe|photoshop|cintiq|24hd|Adobe Flash (Software)|tutorial|Artist|Painting|Educational|Software Tutorial|CS6","604154","41557","214","4504","https://i.ytimg.com/vi/ienN28M-KAg/default.jpg","False","False","➨ Get my APP, Courses, eBooks, Brushes and more:http://www.jazzastudios.com/Shop.php➨ MERCH - Shirts, Hoodies and more:http://jazzastudios.com/Links/shirts.php➨ ART PRINTS and POSTERS:http://jazzastudios.com/Links/prints.php--------------------------------MORE OF ME! - Follow/Sub ↴--------------------------------▶ DAILY VLOG: https://www.youtube.com/dailyjazza▶ Instagram+IGTV: https://instagram.com/DrawWithJazza▶ Twitch: https://www.twitch.tv/DrawWithJazza▶ Twitter: @JosiahBrooks (https://twitter.com/JosiahBrooks)▶ Facebook: http://www.facebook.com/Josiah.Jazza.Brooks--------------------------------Music by Epidemic Sound (http://www.epidemicsound.com)"
"B-HrDYRJMNc","Owner Tells Gordon Ramsay To GET OUT OF HIS KITCHEN | Kitchen Nightmares","2018-10-24T16:00:01.000Z","UCUZzyuAlhHNP3oiuMjn7RfQ","Kitchen Nightmares","24","18.01.11","Gordon Ramsay kitchen nightmares|Gordon Ramsay best insults|kitchen nightmares full episodes|kitchen nightmares online|kitchen nightmares watch online|kitchen nightmares HD|kitchen nightmares best moments|Gordon Ramsay|Kitchen Nightmares|kitchen nightmares el greco jake|kitchen nightmares el greco dustin|kitchen nightmares us s05e10 el greco|kitchen nightmares greek restaurant el greco","2116345","20739","455","2929","https://i.ytimg.com/vi/B-HrDYRJMNc/default.jpg","False","False","Chef Mike at it again. If you liked this clip check out the rest of Gordon's channels:http://www.youtube.com/gordonramsayhttp://www.youtube.com/thefwordhttp://www.youtube.com/kitchennightmaresMore Gordon Ramsay:Website: http://www.gordonramsay.comFacebook: http://www.facebook.com/GordonRamsay01Twitter: http://www.twitter.com/GordonRamsay"
"dz9e3fJ4SuQ","15 Weird Ways To Sneak Candies Into Class / Back To School Pranks","2018-10-23T19:00:02.000Z","UCWwqHwqLSrdWMgp5DZG5Dzg","Troom Troom","26","18.01.11","Back To School Pranks|Back To School|School Pranks|Candies In Class|How To Sneak Candies Into Class|How to sneak|sneak food|food in class|back to school|school|School Supplies|DIY School Supplies|Weird school supplies|DIY Weird school supplies|eating in class|hide food|how to hide food|Stationery|DIY Stationery|Weird Stationery|weird Candies|DIY Candies|Troom Troom School","6346616","42666","6433","3909","https://i.ytimg.com/vi/dz9e3fJ4SuQ/default.jpg","False","False","Subscribe Here: https://goo.gl/KM3Axw11 Morning Routine Unicorn Pranks / Funny Pranks: https://youtu.be/eCdHri3OJkE?list=PLy0LaulZe0vRyRDcwVaqbvnbSqhSQNtS-A sweet pointer! A chocolate school supply cup! And a milkshake in a tie! Did the entire school actually go mad? No! We have just sneaked sweets into class!Supplies and tools• Plastic collar band• Velour• Scissors• Needle and thread• Collapsible plastic vase• Double sided tape• Iron• Parchment paper• Flexible tube• Chewy candies• Food coloring• Ziploc bag• Pencil case• Chocolate bars• Empty glue tube• Yogurt• Tubes with candies• Acrylic paints• Markers• Dark chocolate• Paper cup• Honey• Brush• Icing lace• Wafer paper• Pencil• Food markers• Food paints• Marker• Foil• Candies• White chalk shaped candies• Empty chalk box• Empty triangular pencil box• Printed image of pencils • Hot glue gun• Toblerone• Tape• Jelly candy belts• Gold cardboard from chocolate box• Paint palette• Marshmallows• Butter• Powdered sugar• Empty writing icing tube• Nutella• Printed contour paste label that says Nutella• Wafers• Triangle ruler• Notebook• Utility knife• White cardboard• Ribbon• Food glitter• Empty glitter glue tube• ChopstickMusic: Tobu - Such Funhttp://youtube.com/tobuofficial Released by Ninety9Lives https://www.youtube.com/ninety9livesWatch More Troom Troom: Popular Videos:14 Weird Ways To Sneak Food Into Class / Back To School Pranks:  https://youtu.be/W5p2ndS34vA18 Funny Pranks! Prank Wars! https://youtu.be/yWazGzCNtJ411 DIY Edible Makeup Ideas/11 Funny Pranks:  https://youtu.be/kewz3hF63Xo17 Weird Ways To Sneak Makeup Into Class:  https://youtu.be/bvhBIsmzhwEGummy Food vs Real Food Challenge!  https://youtu.be/jBIG6GsQcq8Popular Playlists:Funny Pranks: https://goo.gl/hi5TWwBack to School: https://goo.gl/J5fhDtLife Hacks: https://goo.gl/Bcd7KWBeauty And Makeup Hacks: https://goo.gl/RqpxqgHome Décor: https://goo.gl/Rh88ELFollow Troom Troom:Subscribe: https://goo.gl/KM3AxwInstagram: https://www.instagram.com/troomtroom/Facebook: https://www.facebook.com/troomhandsPinterest: https://pinterest.com/troomtroom/Troom Troom Español: Subscribe: https://goo.gl/RL3cF2Troom Troom Française:Subscribe: https://goo.gl/1LHrhXTroom Troom Russian: Subscribe: https://goo.gl/kLx8qKTroom Troom Deutsch:Subscribe:  https://goo.gl/qoFyJ4Troom Troom Chinese:Subscribe:  https://goo.gl/T9B6oFTroom Troom Português:Subscribe:  https://goo.gl/Z6vdNCTroom Troom Japanese:Subscribe: https://goo.gl/x3V8HHAbout Troom Troom: Easy DIY how to video tutorials. DIY Accessories, Scrapbooking Cards, Home Décor, Make Up Tutorials, Life Hacks, and MUCH more! Make it easy! For any business enquires please contact me at: troomtroomdiy@gmail.comQuestion of the Day: what ways to sneak food into class you’ve ever encountered? Comment Below!Don’t forget to turn on notifications, like, & subscribe!"
"sXJ2hajo6rw","Ariana Grande - goodnight n go (Audio)","2018-10-25T04:00:03.000Z","UC0VOyT2OCBKdQhF3BAbZ-1g","ArianaGrandeVevo","10","18.01.11","Ariana|Grande|goodnight|go|(Audio)|Universal|Records|Pop","1028357","70669","525","5523","https://i.ytimg.com/vi/sXJ2hajo6rw/default.jpg","False","False","Music video by Ariana Grande performing goodnight n go (Audio). © 2018 Republic Records, a Division of UMG Recordings, Inc.http://vevo.ly/P1aoyE"
"MI19BW6y0jc","Winchester Mansion - Q+A","2018-10-24T22:00:00.000Z","UCKijjvu6bN1c-ZHVwR7-5WA","BuzzFeed Unsolved Network","22","18.01.11","BuzzFeed|Buzzfeed unsolved|unsolved|buzzfeed unsolved network|mystery|unsolved mystery|unexplained|investigation|investigate|investigative|theory|theories|spooky|creepy|eerie|weird|haunted|ghost|supernatural|paranormal|Q+A|questions|answers|fan|season premiere|Winchester|spirit box|winchester house|question and answer|unsolved network","410768","24590","172","1662","https://i.ytimg.com/vi/MI19BW6y0jc/default.jpg","False","False","Is Ryan still afraid of ghosts?Unsolved has merch! Check it out here: https://bzfd.it/shopunsolvedWatch on Amazon Instant Video: http://amzn.to/2nxA2q6Watch on Hulu: https://hulu.tv/2FHqdMT Check out our BuzzFeed Original Series channel on Roku: http://bit.ly/2DUnOlECredits: https://www.buzzfeed.com/bfmp/videos/69512Welcome to the BuzzFeed Unsolved Network! This channel is your one-stop destination for all things mystery, conspiracy, supernatural, true crime, and everything in between. Subscribe here: http://bit.ly/2zuaR06."
"Wiv33Rx1dr0","Adults React To Impossible Odds Compilation (Never Tell Me The Odds)","2018-10-24T21:00:01.000Z","UC0v-tlzsn0QZwJnkiaUSJVQ","FBE","24","18.01.11","Impossible Odds|Impossible Odds Compilation|React Compilation|Adults React to Impossible Odds Compilation|Unbelievable|Crazy Odds|adults react|react|reaction|thefinebros|fine brothers|fine brothers entertainment|finebros|fine bros|FBE|watch|review|for the first time|reviews|responds|respond|youtubers react|elders react|teens react|kids react|parents react|teenagers react","1192941","28760","1525","3017","https://i.ytimg.com/vi/Wiv33Rx1dr0/default.jpg","False","False","Impossible Odds Compilation reacted to by adults, original links belowWatch all main React episodes (Kids/Teens/Elders/Adults/YouTubers): http://goo.gl/4iDVaSUBSCRIBE THEN HIT THE 🔔. New Videos 2pm PT on FBE. http://goo.gl/aFu8CWatch latest videos from FBE: https://goo.gl/aU5PSmAdults react to Impossible Odds Compilation. Watch to see their reactions.Content featured:Taj Gibson Full Court Shothttps://goo.gl/oJMUArhttps://www.reddit.com/r/nevertellmetheodds/comments/9787ad/1010_perfect_form/This Video Of a Man Sliding Into a Pool, All The Way Across And BackOut Has Gone Viralhttps://goo.gl/Z9sCeEhttps://www.reddit.com/r/nevertellmetheodds/comments/93m3o3/im_out_of_here/Fan's beer-cup catch and chughttps://goo.gl/Gbt8HDJenga: removal of bottom piece, unassisted.https://goo.gl/N3Cw9Hhttps://www.reddit.com/r/nevertellmetheodds/comments/974dlx/i_threw_an_egg_at_my_friend_but_instead_of/https://www.instagram.com/p/BnB2pvlge-w/FBE’s goal is to credit the original links to the content featured in its shows. If you see incorrect or missing attribution please reach out to credits@fbeteam.comAdults featured:Aryhttps://www.instagram.com/prettyseed/Brandonhttps://www.youtube.com/c/brandocommandoyaboiBriannahttps://twitter.com/BriannaGurdzhyaDavidhttps://www.instagram.com/johnnydeppstein/Erichttps://www.youtube.com/4N1Labibhttps://www.youtube.com/user/Labib96Laineyhttps://www.youtube.com/user/laineylipsMichellehttps://www.instagram.com/thewickedlady/Sergiohttps://www.instagram.com/isergiofurtado/Shellyhttps://www.instagram.com/fortunesfodder/ MERCH 👕 https://www.shopfbe.comFollow Fine Brothers Entertainment:FBE WEBSITE: http://www.finebrosent.comFBE CHANNEL: http://www.youtube.com/FBEREACT CHANNEL: http://www.youtube.com/REACTBONUS CHANNEL: https://www.youtube.com/FBE2FACEBOOK: http://www.facebook.com/FBEFACEBOOK: http://www.facebook.com/FBEShowsTWITTER: http://www.twitter.com/fbeINSTAGRAM: http://www.instagram.com/fbeSNAPCHAT: https://www.snapchat.com/add/finebrosSOUNDCLOUD: https://soundcloud.com/fbepodcastiTUNES (Podcast): https://goo.gl/DSdGFTGOOGLE PLAY (Podcast): https://goo.gl/UhL6bkMUSICAL.LY: @fbeTWITCH: https://www.twitch.tv/fbeliveAMAZON: https://www.amazon.com/v/FBESEND US STUFF:FBEP.O. BOX 4324Valley Village, CA 91617-4324Creators & Executive Producers - Benny Fine & Rafi FineHead of Production - Nick BergtholdCreative Director & Senior Producer - Derek BaynhamDirector of Post Production - Adam SpeasSupervising Producer - Kyle SegalProducer - Ethan WeiserAssociate Producer - Vartuhi Oganesyan, JC ChavezProduction Coordinator - Alberto AguirreAssistant Production Coordinator - Kristy KieferPost Supervisor - Emily McGuinessEditor - Zach ButlerAssistant Editor - Lizzy SiskindProduction Assistant - Lauren Hutchinson, Oscar Ramos, Jayden RomeroStudio Technician - Josh HiltonSet design - Melissa JudsonMusic - Cyrus Ghahremani© Fine Brothers Entertainment.Adults React #100 - Adults React To Impossible Odds Compilation (Never Tell Me The Odds)"
"kuyfhSNhZog","IF APPS WERE REAL 3","2018-10-24T16:00:08.000Z","UCY30JRSgfhYXA6i6xX1erWg","Smosh","23","18.01.11","apps|if apps were real|if apps were real smosh|smosh|smosh apps|postmates|tinder|tiktok|twitter|bird app|funny|venmo|candy crush|apple|if apps were real 3|if apps were real 2|bumble|instagram|snapchat|vine|pokemon go|musically|tik tok|best apps|android apps|best android apps|ios apps|apple apps|ios|android|phone apps","1800609","36848","2719","2194","https://i.ytimg.com/vi/kuyfhSNhZog/default.jpg","False","False","Huge thanks to new Candy Crush Friends Saga for sponsoring this episode! Are you ready for the sweetest feeling ever? Download now! http://to.king.com/Smoshpitsquad1Twitter, Postmates, Venmo, and more, we wonder what our favorite apps would be like in REAL LIFE!CASTIan HecoxShayne ToppKeith Leak JrOlivia SuiCourtney MillerNoah GrossmanCREWDirected & Produced by Ryan ToddWritten by Ian Hecox, Monica Vasandani, & Ryan FinnertySmosh Co-Founded by Ian Hecox & Anthony PadillaSmosh Creative Director: Luke BaratsDirector of Photography: Mitch AndersonEditors: Mike McNeal & Nick AgichProducer: Kristina NikolicProduction Manager: Jon-Michael BurgessFirst Assistant Director: Tanner RisnerProduction Designer: Tayler NicholsonArt Assistant: Jake SperlingCamera: Brennan IketaniGaffer: Trent TurnerGrip: Josh PitruzzelloSound Mixer: Greg JonesMakeup Artist: Rachel JenkinsCostume Supervisor: Cassidy CombsScript Supervisor: Merina SeidelDIT: Zack BassAssistant Editor: Matthew DuranPost-Production Supervisor: Reed Brice"
"Zj2cK8wymIA","Cardi B - Money (Official Audio)","2018-10-23T16:59:26.000Z","UCxMAbVFmxKUVGAll0WVGpFw","Cardi B","10","18.01.11","Cardi B|Cardi|rap|Bodak Yellow|bloody shoes|red bottoms|i like it|invasion of privacy|offset|bruno mars|finesse|Cardi B Leak|Cardi B Money|Cardi B Shmoney|Cardi B New Music|Cardi B Single|Cardi B Fight|Cardi B Instagram|Cardi B IG Live|Cardi Video|Cardi B preview|Cardi B Offset|Cardi B Bad Bunny|Cardi B Kulture|Cardi B baby video|Cardi B new album|Cardi B Nicki Minaj Diss|_bvLphVWHpo|Zj2cK8wymIA|I was Born to flex|Bands in the coup","18195428","580242","57885","64384","https://i.ytimg.com/vi/Zj2cK8wymIA/default.jpg","False","False","Cardi B - Money (Official Audio)Stream/Download: https://CardiB.lnk.to/moneyIDSubscribe for more official content from Cardi B: https://CardiB.lnk.to/SubscribeFollow Cardi Bhttp://cardibofficial.comhttp://Twitter.com/IAmCardiBhttp://Facebook.com/IAmCardiBhttp://Instagram.com/IAmCardiBhttp://Soundcloud.com/IAmCardiBExclusive Bardi Gang merchandise available here: http://smarturl.it/BardiGangMerchYTThe official YouTube channel of Atlantic Records artist Cardi B. Subscribe for the latest music videos, performances, and more."
"WXdl3mpCbz4","Spice - Black Hypocrisy (Official Music Video)","2018-10-23T11:50:00.000Z","UCV-W40yuzTglTIBg3bEasVA","SpiceOfficialVEVO","10","18.01.11","Spice|Black Hypocrisy|Black Beauty|empowerment|girl power|black|lovely|attractive|courageous|kind|support|dark|dark skin|melanin|black is beautiful|Africa|Caribbean|equality|racism|pride|Masicka|Vybz Kartel|xxtentacion|Alkaline|Popcaan|chronixx|Beenie Man|MAVADO|Busy Signal|Sean Paul|Damian Marley|Sizzla|Shaggy|Tommy Lee|Gyptian|Capleton|Ding Dong|ravers|Aidonia|Konshens|I-Octane|Ioctane|Govana|Rygin","2489837","159338","5106","16477","https://i.ytimg.com/vi/WXdl3mpCbz4/default.jpg","False","False","Black Hypocrisy (Official Music Video)Directed by: Spice and Xtreme ArtsEdited by Xtreme ArtsProduced by: SpiceofficialentFeatured on #Spice mix tape #CapturedFollow Spice:https://www.instagram.com/spiceofficial/https://twitter.com/spiceofficialhttps://www.facebook.com/SpiceOfficially/#BlackHypocrisy  #BlackBeautyCOPYRIGHT STRICTLY ENFORCED DO NOT COPY AND RE-UPLOADYOUR CHANNEL WILL BE STRIKEDhttp://vevo.ly/cP0qnp"
"baHtrip_gTA","Jonah Hill Tells the Backstory of the SNL Character Adam Grossman","2018-10-25T09:00:05.000Z","UCVTyTA7-g9nopHeHbeuvpRA","Late Night with Seth Meyers","23","18.01.11","Late Night|Seth Meyers|Jonah Hill|Tells|Backstory|SNL|Character|Adam Grossman|NBC|NBC TV|television|funny|talk show|comedy|humor|stand-up|parody|snl seth meyers|host|promo|seth|meyers|weekend update|news satire|satire|Superbad|Moneyball|Maniac|21 Jump Street|Jonah Hill on Meyers|Jonah Hill Interview|The Wolf of Wall Street|This Is the End","236320","1920","208","330","https://i.ytimg.com/vi/baHtrip_gTA/default.jpg","False","False","Jonah Hill talks about how skateboarding impacted his life, the magazine he wrote for his film Mid90s and his memories of hosting SNL.» Subscribe to Late Night: http://bit.ly/LateNightSeth» Get more Late Night with Seth Meyers: http://www.nbc.com/late-night-with-seth-meyers/» Watch Late Night with Seth Meyers Weeknights 12:35/11:35c on NBC.LATE NIGHT ON SOCIALFollow Late Night on Twitter: https://twitter.com/LateNightSethLike Late Night on Facebook: https://www.facebook.com/LateNightSethFind Late Night on Tumblr: http://latenightseth.tumblr.com/Connect with Late Night on Google+: https://plus.google.com/+LateNightSeth/videosLate Night with Seth Meyers on YouTube features A-list celebrity guests, memorable comedy, and topical monologue jokes.NBC ON SOCIAL Like NBC: http://Facebook.com/NBCFollow NBC: http://Twitter.com/NBCNBC Tumblr: http://NBCtv.tumblr.com/NBC Pinterest: http://Pinterest.com/NBCtv/NBC Google+: https://plus.google.com/+NBCYouTube: http://www.youtube.com/nbcNBC Instagram: http://instagram.com/nbctvJonah Hill Tells the Backstory of the SNL Character Adam Grossman- Late Night with Seth Meyershttps://youtu.be/baHtrip_gTALate Night with Seth Meyershttp://www.youtube.com/user/latenightseth"
"JCMAw5GUN8w","A Ghost Does My Makeup","2018-10-23T19:00:44.000Z","UCucot-Zp428OwkyRm2I7v2Q","James Charles","24","18.01.11","james|james charles|makeup artist|mua|covergirl|coverboy|cute|jeffree star|easy makeup|how-to|reviews|tutorials|funny videos|beauty tips|hacks|beauty|halloween|halloween makeup|ghost does my makeup|host|horror|ouija board|funny|comedy|james charles halloween|james charles kylie jenner|shane","4493596","329731","33250","35087","https://i.ytimg.com/vi/JCMAw5GUN8w/default.jpg","False","False","HI SISTERS! Happy Halloween season! In today’s video I played with an Ouija board to conjure up some spirits to do my Halloween makeup! Enjoy and don’t forget to thumbs up and subscribe!!Special thank you to one of my best friends Cassiee for sitting in a green morph suit for 3 hours. She’s the best & super talented! http://instagram.com/cassieemua🎥 PREVIOUS VIDEO » https://www.youtube.com/watch?v=i5Z97zashxQ👕 SISTER'S APPAREL » http://sisters-apparel.com🛎 Subscribe to my channel to join the sisterhood & hit the notification bell so you never miss an upload! » http://bit.ly/JamesCharles for new videos!__❤️ LET'S BE BFFSINSTAGRAM » http://instagram.com/jamescharlesTWITTER » http://twitter.com/jamescharlesSNAPCHAT » jamescharless__💸 COUPON CODES 💸MORPHE BRUSHES » http://morphebrushes.comUse code JAMES for 10% off all products online AND in store!UBER » Use code SISTERJAMES for $5 off your first 3 rides!LILLY LASHES » https://lillylashes.com/Use code JAMES for 15% off all lashesLAURAS BOUTIQUE » http://lauras-boutique.comUse code JAMES for 10% off all itemsSKINDINAVIA » http://skindinavia.comUse code JAMES for 25% off all products __♡ MY AMAZING TEAMGREEN SCREEN: CHRIS SMITH & SMITHOUSE PRODUCTIONShttp://instagram.com/smithhouseEDITOR: Louis & Anthony Gargiulahttp://instagram.com/louisgargiulahttp://instagram.com/anthonygargiulaWRITER: Eros Gomezhttp://instagram.com/erosmuaGRAPHICS: Michael Rusakovhttp://instagram.com/michael.ny"
